F21,Organizations that provide substance abuse education programs for people who are at risk for substance abuse in an effort to prevent their involvement with drugs and/or alcohol.,Substance Abuse Prevention,Addiction,Alcohol Abuse Awareness,Alcohol Abuse Education,Alcohol Abuse Prevention,Alcoholism,Chemical Dependency,d a r e,D.A.R.E.,DARE,Drug Abuse Awareness,Drug Abuse Education,Drug Abuse Prevention,Drug Abuse Resistance Education,Drug Addiction,Substance Abuse Awareness,Substance Abuse Education,Substance Abuse Prevention,Substance Dependence,,,,,,,,,,,,,,,,,,,,,,,,,,,,,,,,,,,,,,,,,,,,,,,,,,,,,,,,,,,,,,,,,,,,,,,,,,,,,,,,,,,,,,,,,,,,,,,,,,,,,,,,,,,,,,,,,,,,,,,,,,,,,,,,,,,,,,,,,,,,,,,,,,,,,,,,,,,,,,,,,,,,,,,,,,,,,,,,,,,,,,,,,,,,,,,,,,,,,,,,,,,,,,,
F22,"Organizations that provide inpatient, outpatient or residential treatment services for individuals who have a physical and/or psychological dependency on alcohol and/or drugs.",Substance Abuse Treatment,AA,Addiction,Alanon,Alateen,Alcohol Abuse Counseling,Alcohol Abuse Day Treatment,Alcohol Abuse Half-Way Houses,Alcohol Abuse Hotlines,Alcohol Detoxification,Alcoholics Anonymous,Alcoholism Drop-In Services,Alcoholism Recovery Group Homes,Alcoholism Recovery Hospitals,Alcoholism Rehabilitation,Alcohol-Related Crisis Intervention,Assessment for Substance Abuse,Central Intake/Assessment for Alcohol Abuse,Central Intake/Assessment for Drug Abuse,Central Intake/Assessment for Substance Abuse,Chemical Dependency Recovery Hospitals,Cocaine Anonymous,Drug Abuse Counseling,Drug Abuse Day Treatment,Drug Abuse Drop-In Services,Drug Abuse Half-Way Houses,Drug Abuse Hotlines,Drug Abuse Maintenance Treatment,Drug Abuse Recovery Group Homes,Drug Abuse Rehabilitation,Drug Addiction,Drug Dependency Recovery Hospitals,Drug Detoxification,Drug-Related Crisis Intervention,Emergency Alcoholism Services,Emergency Drug Abuse Services,Heroin Detoxification,Inpatient Alcoholism Treatment,Inpatient Drug Abuse Treatment,Inpatient Substance Abuse Hospitals,Methadone Detoxification,Naranon,Narcotics Anonymous,Outpatient Alcohol Abuse Treatment,Outpatient Drug Abuse Treatment,Outpatient Substance Abuse Treatment,Relapse Prevention/Transitional Substance Abuse,Residential Alcoholism Treatment,Residential Dug Abuse Treatment,Residential Substance Abuse Treatment,Sober Living Centers,Sobering Up Stations,Substance Abuse Counseling,Substance Abuse Crisis Intervention,Substance Abuse Day Treatment,Substance Abuse Drop-In Services,Substance Abuse Half-Way Houses,Substance Abuse Hospitals,Substance Abuse Hotlines,Substance Abuse Maintenance Treatment,Substance Abuse Recovery Group Homes,Substance Abuse Rehabilitation,Substance Dependence,Supportive Recovery Homes,Transitional Housing for Alcohol Abuse,Transitional Housing for Drug Abuse,Transitional Housing for Substance Abuse,Transitional Residential Alcohol Abuse Services,Transitional Residential Drug Abuse Services,Transitional Residential Substance Abuse Services,Twelve-Step Substance Abuse Mutual Support Groups,,,,,,,,,,,,,,,,,,,,,,,,,,,,,,,,,,,,,,,,,,,,,,,,,,,,,,,,,,,,,,,,,,,,,,,,,,,,,,,,,,,,,,,,,,,,,,,,,,,,,,,,,,,,,,,,,,,,,,,,,,,,,,,,,,,,,,,,,,,,,,,,,,,,,,,,,,,
F30,"Organizations that provide preventive, diagnostic and treatment services in a variety of community and hospital-based settings to help people to achieve and maintain a state of emotional well-being, personal empowerment and the skills to cope with everyday demands without excessive stress. Use this code for types of mental health organizations not specified below or for organizations that combine multiple types of care within the same facility.",Mental Health Treatment,Animal-Assisted Therapy,Clinical Evaluation,Early Intervention,Forensic Psychiatric Evaluations,Hug-A-Pet Programs,Mental Health Related,Mental  Health Twelve Step,Mental Health Drop-in Centers,Mental Health Evaluation,Outpatient Mental Health Facilities,Pet-Assisted Therapy,Pet Therapy,Psychiatric Day Treatment Facilities,Psychological Testing,Psychosocial Evaluation,,,,,,,,,,,,,,,,,,,,,,,,,,,,,,,,,,,,,,,,,,,,,,,,,,,,,,,,,,,,,,,,,,,,,,,,,,,,,,,,,,,,,,,,,,,,,,,,,,,,,,,,,,,,,,,,,,,,,,,,,,,,,,,,,,,,,,,,,,,,,,,,,,,,,,,,,,,,,,,,,,,,,,,,,,,,,,,,,,,,,,,,,,,,,,,,,,,,,,,,,,,,,,,,,,
F31,"Organizations that provide diagnostic and inpatient treatment services for individuals who have acute or chronic mental or emotional disturbances, who require hospitalization.",Psychiatric Hospitals,Hospitals for the Mentally Ill,Inpatient Mental Health Facilities,Inpatient Mental Health Treatment,Psychiatric Hospitals,State Mental Hospitals,,,,,,,,,,,,,,,,,,,,,,,,,,,,,,,,,,,,,,,,,,,,,,,,,,,,,,,,,,,,,,,,,,,,,,,,,,,,,,,,,,,,,,,,,,,,,,,,,,,,,,,,,,,,,,,,,,,,,,,,,,,,,,,,,,,,,,,,,,,,,,,,,,,,,,,,,,,,,,,,,,,,,,,,,,,,,,,,,,,,,,,,,,,,,,,,,,,,,,,,,,,,,,,,,,,,,,,,,,,,
F32,"Neighborhood-based organizations that offer counseling, medication and other mental health services for people who have acute or chronic mental or emotional disturbances.",Community Mental Health Centers,Community Mental Health Clinics,Neighborhood Mental Health Centers,,,,,,,,,,,,,,,,,,,,,,,,,,,,,,,,,,,,,,,,,,,,,,,,,,,,,,,,,,,,,,,,,,,,,,,,,,,,,,,,,,,,,,,,,,,,,,,,,,,,,,,,,,,,,,,,,,,,,,,,,,,,,,,,,,,,,,,,,,,,,,,,,,,,,,,,,,,,,,,,,,,,,,,,,,,,,,,,,,,,,,,,,,,,,,,,,,,,,,,,,,,,,,,,,,,,,,,,,,,,,,,
F33,"Organizations that provide a therapeutic living environment in community-based facilities for adults or children with emotional and/or behavioral problems who require a structured, supervised treatment program which may include individual, group, family and other treatment modalities as appropriate.",Residential Mental Health Treatment,Boys Ranches,"Group Homes, Housing",Mental Health Related,Transitional Residential Mental Health Care,"Residential Treatment Facilities, Mental Health Related",,,,,,,,,,,,,,,,,,,,,,,,,,,,,,,,,,,,,,,,,,,,,,,,,,,,,,,,,,,,,,,,,,,,,,,,,,,,,,,,,,,,,,,,,,,,,,,,,,,,,,,,,,,,,,,,,,,,,,,,,,,,,,,,,,,,,,,,,,,,,,,,,,,,,,,,,,,,,,,,,,,,,,,,,,,,,,,,,,,,,,,,,,,,,,,,,,,,,,,,,,,,,,,,,,,,,,,,,,,,
F40,"Organizations that provide in-person or telephone assistance for people who are in acute emotional distress; who are a danger to themselves or to others; who are having suicidal feelings; or who are hysterical, frightened or otherwise unable to cope with a problem that requires immediate action. Use this code for crisis intervention services or hotlines not specified below or for organizations that offer multiple types of crisis intervention, hotline services.",Hot Lines & Crisis Intervention,Crisis Intervention Groups,Telephone Crisis Hotlines,Helplines,Hotlines,Mental Health Hotlines,Suicide Prevention,,,,,,,,,,,,,,,,,,,,,,,,,,,,,,,,,,,,,,,,,,,,,,,,,,,,,,,,,,,,,,,,,,,,,,,,,,,,,,,,,,,,,,,,,,,,,,,,,,,,,,,,,,,,,,,,,,,,,,,,,,,,,,,,,,,,,,,,,,,,,,,,,,,,,,,,,,,,,,,,,,,,,,,,,,,,,,,,,,,,,,,,,,,,,,,,,,,,,,,,,,,,,,,,,,,,,,,,,,,
F42,"Organizations that provide telephone crisis intervention services or crisis, short-term and/or ongoing in-person counseling for people who have been sexually assaulted.",Sexual Assault Services,Rape Crisis Counseling,Rape Victim Hotlines,Sexual Assault Services,,,,,,,,,,,,,,,,,,,,,,,,,,,,,,,,,,,,,,,,,,,,,,,,,,,,,,,,,,,,,,,,,,,,,,,,,,,,,,,,,,,,,,,,,,,,,,,,,,,,,,,,,,,,,,,,,,,,,,,,,,,,,,,,,,,,,,,,,,,,,,,,,,,,,,,,,,,,,,,,,,,,,,,,,,,,,,,,,,,,,,,,,,,,,,,,,,,,,,,,,,,,,,,,,,,,,,,,,,,,,,
F50,"Organizations that provide counseling, medical treatment (where indicated) and other supportive services for individuals who have a psychological dependency involving a particular pattern of behavior, e.g., spending money, sexual compulsions and workaholic behavior.",Addictive Disorders N.E.C.,Addictive Behavior,Compulsive Behavior,Computer Addiction,Pathological Cravings,Shopaholic,Workaholic,,,,,,,,,,,,,,,,,,,,,,,,,,,,,,,,,,,,,,,,,,,,,,,,,,,,,,,,,,,,,,,,,,,,,,,,,,,,,,,,,,,,,,,,,,,,,,,,,,,,,,,,,,,,,,,,,,,,,,,,,,,,,,,,,,,,,,,,,,,,,,,,,,,,,,,,,,,,,,,,,,,,,,,,,,,,,,,,,,,,,,,,,,,,,,,,,,,,,,,,,,,,,,,,,,,,,,,,,,,
F52,Organizations that utilize a variety of techniques to help people who wish to control their dependence on nicotine and give up substances containing nicotine. Also included are smoking education/prevention programs that help persuade people to avoid the habit before they start.,Smoking Addiction,Anti-Smoking Campaigns,Nicotine Addiction,Nicotine Dependency,Smoking Cessation,Smoking Education,Smoking Prevention,Smoking Withdrawal Clinics,Stop Smoking,Tobacco Addiction,Tobacco Habit,,,,,,,,,,,,,,,,,,,,,,,,,,,,,,,,,,,,,,,,,,,,,,,,,,,,,,,,,,,,,,,,,,,,,,,,,,,,,,,,,,,,,,,,,,,,,,,,,,,,,,,,,,,,,,,,,,,,,,,,,,,,,,,,,,,,,,,,,,,,,,,,,,,,,,,,,,,,,,,,,,,,,,,,,,,,,,,,,,,,,,,,,,,,,,,,,,,,,,,,,,,,,,,,,,,,,,,
F53,"Organizations that provide diagnostic and treatment services for individuals who have anorexia nervosa, bulimarexia, bulimia or a related eating disorder.",Eating Disorders & Addictions,Anorexia,Binge Eating,Boulimia,Bulimarexia,Bulimia,Dysorexia,Eating Addictions,Eating Disorders,Hyperphagia,Obesity,Overeating,Pica,Rumination Disorder,,,,,,,,,,,,,,,,,,,,,,,,,,,,,,,,,,,,,,,,,,,,,,,,,,,,,,,,,,,,,,,,,,,,,,,,,,,,,,,,,,,,,,,,,,,,,,,,,,,,,,,,,,,,,,,,,,,,,,,,,,,,,,,,,,,,,,,,,,,,,,,,,,,,,,,,,,,,,,,,,,,,,,,,,,,,,,,,,,,,,,,,,,,,,,,,,,,,,,,,,,,,,,,,,,,,
F54,"Organizations that provide emotional support, information and guidance for people who are having difficulty controlling their compulsion to gamble.",Gambling Addiction,Compulsive Gambling,Gamblers Anonymous,Pathological Gambling,,,,,,,,,,,,,,,,,,,,,,,,,,,,,,,,,,,,,,,,,,,,,,,,,,,,,,,,,,,,,,,,,,,,,,,,,,,,,,,,,,,,,,,,,,,,,,,,,,,,,,,,,,,,,,,,,,,,,,,,,,,,,,,,,,,,,,,,,,,,,,,,,,,,,,,,,,,,,,,,,,,,,,,,,,,,,,,,,,,,,,,,,,,,,,,,,,,,,,,,,,,,,,,,,,,,,,,,,,,,,,
F60,"Organizations that provide treatment services which may include emotional support, problem-solving assistance, information and guidance through a variety of counseling modalities for individuals who are having difficulty in coping with a traumatic experience or a personal relationship or in making the adjustments that are required by their particular stage in life.",Counseling,Adolescent Counseling,Adult Incest Survivor Counseling,Anger Management,Bereavement Counseling,Child Abuse Counseling,CISD,Critical Incident Stress Debriefing,Cult Membership Counseling,Cultural Transition Counseling,Disability Counseling,Elder Abuse Counseling,Employee Assistance,Employment Transition Counseling,Family Violence Counseling,Geriatric Counseling,Gestalt Therapy,Grief Counseling,Health Problems Counseling,Parent Abuse Counseling,Peer Counseling,Psychiatric Disorder Counseling,Sexual Offender Counseling,Sexual Orientation Counseling,Sexuality Counseling,Spousal Abuse Counseling,Spouse Abuse Counseling,Terminal Illness Counseling,Veteran Counseling,Youth Counseling,,,,,,,,,,,,,,,,,,,,,,,,,,,,,,,,,,,,,,,,,,,,,,,,,,,,,,,,,,,,,,,,,,,,,,,,,,,,,,,,,,,,,,,,,,,,,,,,,,,,,,,,,,,,,,,,,,,,,,,,,,,,,,,,,,,,,,,,,,,,,,,,,,,,,,,,,,,,,,,,,,,,,,,,,,,,,,,,,,,,,,,,,,,,,,,,,,,,
F70,"Organizations that provide preventive, diagnostic and treatment services that focus on a particular mental health disorder.",Mental Health Disorders,Acute Stress Disorder,ADD,ADHD,Adjustment Disorders,Affective Disorders,Agoraphobia,Amnesia Antisocial Personality Disorder,Anxiety Disorders,Attention Deficit & Disruptive Behavior Disorders,Attention Deficit Disorders,Attention-Deficiency/Hyperactivity Disorder,Avoidant Personality Disorder,Bipolar Disorder,Body Dymorphic Disorder,Borderline Personality Disorder,Breathing-Related Sleep Disorder,Briquet Syndrome,Capgras Syndrome,Catatonic Schizophrenia,Child Mental Disorders,Childhood Mental Health Disorders,Circadian Rhythm Sleep Disorder,Clereambault Syndrome,Cognitive Disorders,Conduct Disorders,Conversion Disorder,Cyclothymic Disorder,Delirium,Delusional Disorder,Dementia,Dependent Personality Disorder,Depersonalization Disorder,Depression,Disorganized Schizophrenia,Disruptive Behavior Disorders,Dissociative Amnesia,Dissociative Disorders,Dissociative Identity Disorder,Dysthymic Disorder,Encopresis,Enuresis,Exhibitionism,Factitious Disorders,False Memory Syndrome,Fetishism,Frotteurism,Fugue,GAD: Ganser Syndrome,Gender Dysphoria,Gender Identity Disorder,Generalized Anxiety Disorders,Histrionic Personality Disorder,Hypersomnia,Hypochondria,Hypocondriasis,Hysteria,Insomnia,Intermittent Explosive Disorder,Kleptomania,Kluver-Bucy Syndrome,Manic Depression,Masochism,Mental Disorders,Mental Illness,Mood Disorders,Multiple Personality Disorder,Munchausen Syndrome,Mutism,Narcissistic Personality Disorder,Nightmare Disorder,Obsessive-Compulsive Disorders,Obsessive-Compulsive Personality Disorder,OCD,ODD,Oppositional Defiant Disorder,Organic Mental Disorders,Pain Disorders,Panic Attacks,Panic Disorder,Paranoid Personality Disorder,Paranoid Schizophrenia,Paraphilias,Parasomnias,Passive-Aggressive Personality Disorder,Pedophilia,Personality Disorders,Postpartum Depression,Posttraumatic Stress Syndrome,Pseudodementia,Pseudopsychosis,Psychiatric Illness,Psychological Sexual Dysfunctions,Psychotic Disorders,Psychotic Disorders,Pyromania,Sadism,Schizoid Personality Disorder,Schizophrenia,Schizotypal Personality Disorder,Seasonal Affective Disorder,Separation Anxiety,Sexual & Gender Identity Disorders,Sexual Arousal Disorders,Sexual Desires Disorders,Sexual Masochism,Sexual Sadism,Shared Paranoid Schizophrenia,Sleep Disorders,Sleep Terror Disorder,Sleepwalking Disorders,Social Phobia,Somatoform Disorders,Stereotypic Movement Disorder,Stress Related Disorders,Tic Disorders,Tourette Syndrome,Transvestic Fetishism,Traumatic Psychoses,Trichotillomania,Vaginismus,Voyeurism,,,,,,,,,,,,,,,,,,,,,,,,,,,,,,,,,,,,,,,,,,,,,,,,,,,,,,,,,,,,,,,,,,,,,,,,,,,,,,,,,,,,,,,,,,,,,,,,,,,,,,,,
F80,Organizations whose purpose is to promote social conditions that enhance the potential in the community for good mental health and to improve methods and facilities for treating mental illness.,Mental Health Associations,Multipurpose Mental Health Associations,,,,,,,,,,,,,,,,,,,,,,,,,,,,,,,,,,,,,,,,,,,,,,,,,,,,,,,,,,,,,,,,,,,,,,,,,,,,,,,,,,,,,,,,,,,,,,,,,,,,,,,,,,,,,,,,,,,,,,,,,,,,,,,,,,,,,,,,,,,,,,,,,,,,,,,,,,,,,,,,,,,,,,,,,,,,,,,,,,,,,,,,,,,,,,,,,,,,,,,,,,,,,,,,,,,,,,,,,,,,,,,,
F99,Use this code for organizations that clearly provide mental health services where the major purpose is unclear enough that a more specific code cannot be accurately assigned.,Mental Health & Crisis Intervention N.E.C.,,,,,,,,,,,,,,,,,,,,,,,,,,,,,,,,,,,,,,,,,,,,,,,,,,,,,,,,,,,,,,,,,,,,,,,,,,,,,,,,,,,,,,,,,,,,,,,,,,,,,,,,,,,,,,,,,,,,,,,,,,,,,,,,,,,,,,,,,,,,,,,,,,,,,,,,,,,,,,,,,,,,,,,,,,,,,,,,,,,,,,,,,,,,,,,,,,,,,,,,,,,,,,,,,,,,,,,,,,,,,,,,,
G,,Voluntary Health Associations & Medical Disciplines,,,,,,,,,,,,,,,,,,,,,,,,,,,,,,,,,,,,,,,,,,,,,,,,,,,,,,,,,,,,,,,,,,,,,,,,,,,,,,,,,,,,,,,,,,,,,,,,,,,,,,,,,,,,,,,,,,,,,,,,,,,,,,,,,,,,,,,,,,,,,,,,,,,,,,,,,,,,,,,,,,,,,,,,,,,,,,,,,,,,,,,,,,,,,,,,,,,,,,,,,,,,,,,,,,,,,,,,,,,,,,,,,
G01,Organizations whose activities focus on influencing public policy within the Voluntary Health Associations and Medical Disciplines major group area. Includes a variety of activities from public education and influencing public opinion to lobbying national and state legislatures.,Alliances & Advocacy,Lobbying,Public Awareness,,,,,,,,,,,,,,,,,,,,,,,,,,,,,,,,,,,,,,,,,,,,,,,,,,,,,,,,,,,,,,,,,,,,,,,,,,,,,,,,,,,,,,,,,,,,,,,,,,,,,,,,,,,,,,,,,,,,,,,,,,,,,,,,,,,,,,,,,,,,,,,,,,,,,,,,,,,,,,,,,,,,,,,,,,,,,,,,,,,,,,,,,,,,,,,,,,,,,,,,,,,,,,,,,,,,,,,,,,,,,,,
G02,"Consultation, training, and other forms of management assistance services to nonprofit groups within the Voluntary Health Associations and Medical Disciplines major group area.",Management & Technical Assistance,Professional Continuing Education,,,,,,,,,,,,,,,,,,,,,,,,,,,,,,,,,,,,,,,,,,,,,,,,,,,,,,,,,,,,,,,,,,,,,,,,,,,,,,,,,,,,,,,,,,,,,,,,,,,,,,,,,,,,,,,,,,,,,,,,,,,,,,,,,,,,,,,,,,,,,,,,,,,,,,,,,,,,,,,,,,,,,,,,,,,,,,,,,,,,,,,,,,,,,,,,,,,,,,,,,,,,,,,,,,,,,,,,,,,,,,,,
G03,"Learned societies, professional councils, and other organizations that bring together individuals or organizations with a common professional or vocational interest within the Voluntary Health Associations and Medical Disciplines major group area.",Professional Societies & Associations,,,,,,,,,,,,,,,,,,,,,,,,,,,,,,,,,,,,,,,,,,,,,,,,,,,,,,,,,,,,,,,,,,,,,,,,,,,,,,,,,,,,,,,,,,,,,,,,,,,,,,,,,,,,,,,,,,,,,,,,,,,,,,,,,,,,,,,,,,,,,,,,,,,,,,,,,,,,,,,,,,,,,,,,,,,,,,,,,,,,,,,,,,,,,,,,,,,,,,,,,,,,,,,,,,,,,,,,,,,,,,,,,
G05,Organizations whose primary purpose is to conduct research and/or public policy research within the Voluntary Health Associations and Medical Disciplines major group area.,Research Institutes & Public Policy Analysis,,,,,,,,,,,,,,,,,,,,,,,,,,,,,,,,,,,,,,,,,,,,,,,,,,,,,,,,,,,,,,,,,,,,,,,,,,,,,,,,,,,,,,,,,,,,,,,,,,,,,,,,,,,,,,,,,,,,,,,,,,,,,,,,,,,,,,,,,,,,,,,,,,,,,,,,,,,,,,,,,,,,,,,,,,,,,,,,,,,,,,,,,,,,,,,,,,,,,,,,,,,,,,,,,,,,,,,,,,,,,,,,,
G11,Organizations existing as a support and fund-raising entity for a single institution within the Voluntary Health Associations and Medical Disciplines major group area.,Single Organization Support,,,,,,,,,,,,,,,,,,,,,,,,,,,,,,,,,,,,,,,,,,,,,,,,,,,,,,,,,,,,,,,,,,,,,,,,,,,,,,,,,,,,,,,,,,,,,,,,,,,,,,,,,,,,,,,,,,,,,,,,,,,,,,,,,,,,,,,,,,,,,,,,,,,,,,,,,,,,,,,,,,,,,,,,,,,,,,,,,,,,,,,,,,,,,,,,,,,,,,,,,,,,,,,,,,,,,,,,,,,,,,,,,
G12,Organizations that raise and distribute funds for multiple organizations within the Voluntary Health Associations and Medical Disciplines major group area.,Fund Raising & Fund Distribution,,,,,,,,,,,,,,,,,,,,,,,,,,,,,,,,,,,,,,,,,,,,,,,,,,,,,,,,,,,,,,,,,,,,,,,,,,,,,,,,,,,,,,,,,,,,,,,,,,,,,,,,,,,,,,,,,,,,,,,,,,,,,,,,,,,,,,,,,,,,,,,,,,,,,,,,,,,,,,,,,,,,,,,,,,,,,,,,,,,,,,,,,,,,,,,,,,,,,,,,,,,,,,,,,,,,,,,,,,,,,,,,,
G19,Organizations that provide all forms of support except for financial assistance or fund raising for other organizations within the Voluntary Health Associations and Medical Disciplines major group area.,Support N.E.C.,,,,,,,,,,,,,,,,,,,,,,,,,,,,,,,,,,,,,,,,,,,,,,,,,,,,,,,,,,,,,,,,,,,,,,,,,,,,,,,,,,,,,,,,,,,,,,,,,,,,,,,,,,,,,,,,,,,,,,,,,,,,,,,,,,,,,,,,,,,,,,,,,,,,,,,,,,,,,,,,,,,,,,,,,,,,,,,,,,,,,,,,,,,,,,,,,,,,,,,,,,,,,,,,,,,,,,,,,,,,,,,,,
G20,Voluntary health organizations active in the prevention or treatment of illnesses or conditions that are hereditary and passed from parent to offspring. Use this code for organizations that focus on a wide variety of genetic disorders or on genetic disorders not specified below.,Birth Defects & Genetic Diseases,Achronplasia,Alagille Syndrome,Albinism,Amaurotic Familial Idiocy,Bardet-Biedl Syndrome,Birth Defects,Cerebral Palsy,Charcot-Marie Disease,Charcot-Marie-Tooth Disease,Chromosome Disorders,Clubfoot,Coffin-Lowrey Syndrome,Congenital Defects,Cri-du-Chat Syndrome,Crying Cat Syndrome,Cryptorchidism,Cystic Fibrosis,Cytochrome-c Oxidase Deficiency,Dandy-Walker Syndrome,De Lange Syndrome,Developmental Coordination Disorder,Factor X Deficiency,Fetal Alcohol Syndrome,Fragile X Syndrome,Friedreich Ataxia,Genetic Diseases,Hemophilia,Hereditary Diseases,Huntingtons Disease,Jervell-Lange Nielsen Syndrome,Kartagener Syndrome,Klinefelter Syndrome,Laurence-Moon Syndrome,Leigh Disease,Lesch-Nyhan Syndrome,Littles Disease,Lynch Syndrome,March of Dimes,Marfan Syndrome,Martin-Bell Syndrome,Mental Retardation,Motor Skills Disorder,Neurofibromatosis,Oral-Facial Clefts,Phenylketonuria,PKU,Porphyria,Prader-Willi Syndrome,Pseudoxanthoma Elasticum,Pyruvate Carboxylase Deficiency Disease,Pyruvate Dehydrogenase Complex Deficiency Disease,Rett Disorder,Rett Syndrome,Retts Disorder,Retts Syndrome,Rett's Disorder,Rett's Syndrome,Rh Disease,Romano-Ward Syndrome,Rubinstein-Taybi Syndrome,Sickle Cell,Spina Bifida,Sudden Infant Death,Tay Sachs,Testicular Feminization Syndrome,Thalassemia,Turner Syndrome,Turners Syndrome,WAGR Syndrome,Werner Syndrome,Williams Syndrome,Xeroderma Pigmentosum,,,,,,,,,,,,,,,,,,,,,,,,,,,,,,,,,,,,,,,,,,,,,,,,,,,,,,,,,,,,,,,,,,,,,,,,,,,,,,,,,,,,,,,,,,,,,,,,,,,,,,,,,,,,,,,,,,,,,,,,,,,,,,,,,,,,,,,,,,,,,,,,,,,,,,,,,
G25,"Voluntary health organizations active in the prevention or treatment of Down Syndrome, a hereditary condition that results in mental retardation.",Down Syndrome,21-Trisomy,Down Anomaly,Downs Anomaly,Downs Syndrome,Mongolism,Trisomy 21,,,,,,,,,,,,,,,,,,,,,,,,,,,,,,,,,,,,,,,,,,,,,,,,,,,,,,,,,,,,,,,,,,,,,,,,,,,,,,,,,,,,,,,,,,,,,,,,,,,,,,,,,,,,,,,,,,,,,,,,,,,,,,,,,,,,,,,,,,,,,,,,,,,,,,,,,,,,,,,,,,,,,,,,,,,,,,,,,,,,,,,,,,,,,,,,,,,,,,,,,,,,,,,,,,,,,,,,,,,
G30,"Voluntary health organizations active in the prevention or treatment of cancer. The associated medical specialty is medical oncology, a subspecialty of internal medicine.",Cancer,Bladder Cancer,Bone Cancer,Burkitts Lymphoma,Cancer,Carcinoma,Cervical Cancer,Colon Cancer,Colorectal Cancer,Fallopian Tube Cancer,Kaposi Sarcoma,Leukemia,Liver Cancer,Lung Cancer,Lymphoma,Melanoma,Multiple Myeloma,Oral Cancer,Ovarian Cancer,Pagets Disease,Pancreatic Cancer,Prostate Cancer,Rectal Cancer,Renal Cancer,Sarcoma,Skin Cancer,Stomach Cancer,Testicular Cancer,Uterine Cancer,Vaginal Cancer,Vulva Cancer,Womens Cancer,,,,,,,,,,,,,,,,,,,,,,,,,,,,,,,,,,,,,,,,,,,,,,,,,,,,,,,,,,,,,,,,,,,,,,,,,,,,,,,,,,,,,,,,,,,,,,,,,,,,,,,,,,,,,,,,,,,,,,,,,,,,,,,,,,,,,,,,,,,,,,,,,,,,,,,,,,,,,,,,,,,,,,,,,,,,,,,,,,,,,,,,,,,,,,,,,,
G32,Voluntary health organizations active in the prevention or treatment of breast cancer.,Breast Cancer,Breast cancer,,,,,,,,,,,,,,,,,,,,,,,,,,,,,,,,,,,,,,,,,,,,,,,,,,,,,,,,,,,,,,,,,,,,,,,,,,,,,,,,,,,,,,,,,,,,,,,,,,,,,,,,,,,,,,,,,,,,,,,,,,,,,,,,,,,,,,,,,,,,,,,,,,,,,,,,,,,,,,,,,,,,,,,,,,,,,,,,,,,,,,,,,,,,,,,,,,,,,,,,,,,,,,,,,,,,,,,,,,,,,,,,
G40,Voluntary health organizations active in the prevention or treatment of diseases and conditions that affect specific organs or organ systems in the body. Use this code for organizations that focus on diseases that affect a wide range of organs or organ systems or on those not specified below.,Diseases of Specific Organs,Alopecia,alpha 1-Antitrypsin Deficiency,Bedwetting,Bladder Diseases,Cystitis,Diseases of the Spleen,Dwarfism,Dystrophic Epidermolysis Bullosa,Endometriosis,Enuresis,Epididymitis,Erectile Dysfunction,Female Genital Diseases,Genitourinary Diseases,Hansens Disease,Hematuria,Hemoglobinuria,Hepatitis,Hydrocele,Impotence,Incontinence,Infertility,Leprosy,Liver Diseases,Male Genital Diseases,Menopausal Disorders,Oliguria,Ovarian Cysts,Penile Diseases,Polyuria,Prostatic Diseases,Psoriasis,Renal Failure,Sjogrens Syndrome,Skin Diseases,Thyroid Diseases,Ureteral Diseases,Urethral Diseases,Urinary Tract Infections,Urination Disorders,Urogenital Diseases,Uterine Diseases,Vaginal Diseases,Vesico-Ureteral Reflux,Vitiligo,Vulvar Diseases,,,,,,,,,,,,,,,,,,,,,,,,,,,,,,,,,,,,,,,,,,,,,,,,,,,,,,,,,,,,,,,,,,,,,,,,,,,,,,,,,,,,,,,,,,,,,,,,,,,,,,,,,,,,,,,,,,,,,,,,,,,,,,,,,,,,,,,,,,,,,,,,,,,,,,,,,,,,,,,,,,,,,,,,,,,,,,,,,,,
G41,Voluntary health organizations active in the prevention or treatment of blindness and diseases or other conditions that affect the eyes. The associated medical specialty is ophthalmology.,"Eye Diseases, Blindness & Vision Impairments",Achromatic Vision,Amaurosis,Amblyopia,Ametropia,Aniseikonia,Anisometropia,Asthenopia,Astigmatism,Blindness,Choroid Diseases,Color Blindness,Conjunctival Diseases,Corneal Diseases,Diochromatic Vision,Diplopia,Double Vision,Duane Retraction Syndrome,Eyelid Diseases,Glaucoma,Hemeralopia,Hemianopsia,Hyperopia,Lacrimal Apparatus Diseases,Lens Diseases,Low Vision,Macular Degeneration,Miller Fisher Syndrome,Myopia,Night Blindness,Nyctalopia,Ocular Hypertension,Ocular Hypotension,Ocular Motility Disorders,Optic Nerve Diseases,Orbital Diseases,Presbyopia,Proliferative Vitreoretinopathy,Pupil Disorders,Refractive Errors,Retenal Diseases,Retinal Dysplasia,Retinitis Pigmentosa,Retinitis,Scleral Diseases,Scleritis,Scotoma,Scotoma,Strabismus,Tolosa-Hunt Syndrome,Tunnel Vision,Uveal Diseases,Uvenitis,Vision Disorders,Vitreous Detachment,,,,,,,,,,,,,,,,,,,,,,,,,,,,,,,,,,,,,,,,,,,,,,,,,,,,,,,,,,,,,,,,,,,,,,,,,,,,,,,,,,,,,,,,,,,,,,,,,,,,,,,,,,,,,,,,,,,,,,,,,,,,,,,,,,,,,,,,,,,,,,,,,,,,,,,,,,,,,,,,,,,,,,,,,,,
G42,"Voluntary health organizations active in the prevention or treatment of diseases or conditions that affect the head and neck including the ears, the respiratory and upper alimentary systems, the face, the jaws and related structures. The related medical specialty is otolaryngology.",Ear & Throat Diseases,Apnea,Cheyne-Stokes Respiration,Ciliary Motility Disorders,Cochlear Diseases,Croup,Deafness,Endolymphatic Hydrops,Glue Ear,Hearing Disorders,Hearing Impairments,Hearing Loss,Herpes Zoster Oticus,Hyperacusis,Hyperventilation,Kartagener Syndrome,Labyrinth Diseases,Labyrinthitis,Laryngeal Diseases,Laryngismus,Laryngitis,Laryngostenosis,Menieres Disease,Middle Ear Cholesteatoma,Motion Sickness,Nasopharyngeal Diseases,Nose Diseases,Otitis,Otorhinolaryngologic Diseases,Otosclerosis,Pharyngeal Diseases,Pharyngeal Diseases,Pharyngitis,Retrocochlear Diseases,Retropharyngeal Abscess,Rhinoscleroma,Sinusitis,Sleep Apnea,Thoracic Diseases,Tinnitus,Tone Deafness,Tonsillitis,Tympanic Membrane Perforation,Velopharyngeal Insufficiency,Vertigo,Vestibular Diseases,Vocal Cord Paralysis,Voice Disorders,Whooping Cough,,,,,,,,,,,,,,,,,,,,,,,,,,,,,,,,,,,,,,,,,,,,,,,,,,,,,,,,,,,,,,,,,,,,,,,,,,,,,,,,,,,,,,,,,,,,,,,,,,,,,,,,,,,,,,,,,,,,,,,,,,,,,,,,,,,,,,,,,,,,,,,,,,,,,,,,,,,,,,,,,,,,,,,,,,,,,,,,,
