I70,"Organizations that attempt to reduce the incidence of child abuse, elder abuse and spouse abuse in family settings through educational interventions which may focus on children of various ages, parents, people who work with families and/or the community at large.",Protection Against Abuse,Abuse of the Elderly,Abuse Prevention,Crimes Against the Elderly,Domestic Violence,Elder Abuse,Granny Bashing,Granny Dumping,King Lear Syndrome,Violence in the Family,Violence Prevention,Violent Families,,,,,,,,,,,,,,,,,,,,,,,,,,,,,,,,,,,,,,,,,,,,,,,,,,,,,,,,,,,,,,,,,,,,,,,,,,,,,,,,,,,,,,,,,,,,,,,,,,,,,,,,,,,,,,,,,,,,,,,,,,,,,,,,,,,,,,,,,,,,,,,,,,,,,,,,,,,,,,,,,,,,,,,,,,,,,,,,,,,,,,,,,,,,,,,,,,,,,,,,,,,,,,,,,,,,,,
I71,"Organizations that deal specifically with the prevention of domestic violence through educational interventions which may focus on batterers, people at risk for domestic violence, people who work with battered women and/or the community at large.",Spouse Abuse Prevention,Battered Husbands,Battered Wives,Conjugal Crime Prevention,Domestic Abuse Prevention,Domestic Rape Prevention,Domestic Violence,Husband Abuse Prevention,Marital Rape Prevention,Spousal Abuse Prevention,Wife Abuse Prevention,,,,,,,,,,,,,,,,,,,,,,,,,,,,,,,,,,,,,,,,,,,,,,,,,,,,,,,,,,,,,,,,,,,,,,,,,,,,,,,,,,,,,,,,,,,,,,,,,,,,,,,,,,,,,,,,,,,,,,,,,,,,,,,,,,,,,,,,,,,,,,,,,,,,,,,,,,,,,,,,,,,,,,,,,,,,,,,,,,,,,,,,,,,,,,,,,,,,,,,,,,,,,,,,,,,,,,,
I72,"Organizations that deal specifically with the prevention of child abuse including incest through educational interventions which may focus on children of various ages, parents, people who work with families and/or the community at large.",Child Abuse Prevention,Abuse of Children,Abused Children,Abusive Parents,Battered Children,CAC,Child Abuse Hotlines,Child Abuse Prevention,Child Neglect,Child Protection,Cruelty to Children,Domestic Violence,Incest,Infanticide,Parents Anonymous,Prevention of Child Mistreatment,Shaken Baby Syndrome,,,,,,,,,,,,,,,,,,,,,,,,,,,,,,,,,,,,,,,,,,,,,,,,,,,,,,,,,,,,,,,,,,,,,,,,,,,,,,,,,,,,,,,,,,,,,,,,,,,,,,,,,,,,,,,,,,,,,,,,,,,,,,,,,,,,,,,,,,,,,,,,,,,,,,,,,,,,,,,,,,,,,,,,,,,,,,,,,,,,,,,,,,,,,,,,,,,,,,,,,,,,,,,,,
I73,Organizations that deal specifically with the prevention of sexual assault (for adults and children).,Sexual Abuse Prevention,Child Molestation Prevention,Dating Violence Prevention,Domestic Violence,Rape Prevention,Sexual Assault Prevention,Sex Offender Registration,,,,,,,,,,,,,,,,,,,,,,,,,,,,,,,,,,,,,,,,,,,,,,,,,,,,,,,,,,,,,,,,,,,,,,,,,,,,,,,,,,,,,,,,,,,,,,,,,,,,,,,,,,,,,,,,,,,,,,,,,,,,,,,,,,,,,,,,,,,,,,,,,,,,,,,,,,,,,,,,,,,,,,,,,,,,,,,,,,,,,,,,,,,,,,,,,,,,,,,,,,,,,,,,,,,,,,,,,,,
I80,Organizations that provide general legal aid regarding criminal and/or civil matters at little or no cost for individuals who are economically disadvantaged.,Legal Services,Court-appointed Counsel,Discrimination Assistance,Equal Employment Opportunity,Fair Housing,Fair Housing Counseling,Guardians ad Litem,Guardianship,Housing Discrimination Assistance,Housing Discrimination Counseling,Landlord/Tenant Law,Legal Aid,Legal Aid to the Poor,Legal Counseling,Legal Representation,Legal Services for Indigents,Pro Bono Cases,Public Defenders,,,,,,,,,,,,,,,,,,,,,,,,,,,,,,,,,,,,,,,,,,,,,,,,,,,,,,,,,,,,,,,,,,,,,,,,,,,,,,,,,,,,,,,,,,,,,,,,,,,,,,,,,,,,,,,,,,,,,,,,,,,,,,,,,,,,,,,,,,,,,,,,,,,,,,,,,,,,,,,,,,,,,,,,,,,,,,,,,,,,,,,,,,,,,,,,,,,,,,,,,,,,,,,,
I83,Organizations that primarily handle class action litigation and lawsuits related to issues of interest to the public in general rather than assisting individuals.,Public Interest Law,Class Action Lawsuits,Public Interest Law,Public Interest Litigation,,,,,,,,,,,,,,,,,,,,,,,,,,,,,,,,,,,,,,,,,,,,,,,,,,,,,,,,,,,,,,,,,,,,,,,,,,,,,,,,,,,,,,,,,,,,,,,,,,,,,,,,,,,,,,,,,,,,,,,,,,,,,,,,,,,,,,,,,,,,,,,,,,,,,,,,,,,,,,,,,,,,,,,,,,,,,,,,,,,,,,,,,,,,,,,,,,,,,,,,,,,,,,,,,,,,,,,,,,,,,,
I99,Use this code for organizations that clearly provide crime and legal related services where the major purpose is unclear enough that a more specific code cannot be accurately assigned.,Crime & Legal-Related N.E.C.,,,,,,,,,,,,,,,,,,,,,,,,,,,,,,,,,,,,,,,,,,,,,,,,,,,,,,,,,,,,,,,,,,,,,,,,,,,,,,,,,,,,,,,,,,,,,,,,,,,,,,,,,,,,,,,,,,,,,,,,,,,,,,,,,,,,,,,,,,,,,,,,,,,,,,,,,,,,,,,,,,,,,,,,,,,,,,,,,,,,,,,,,,,,,,,,,,,,,,,,,,,,,,,,,,,,,,,,,,,,,,,,,
J,,Employment,,,,,,,,,,,,,,,,,,,,,,,,,,,,,,,,,,,,,,,,,,,,,,,,,,,,,,,,,,,,,,,,,,,,,,,,,,,,,,,,,,,,,,,,,,,,,,,,,,,,,,,,,,,,,,,,,,,,,,,,,,,,,,,,,,,,,,,,,,,,,,,,,,,,,,,,,,,,,,,,,,,,,,,,,,,,,,,,,,,,,,,,,,,,,,,,,,,,,,,,,,,,,,,,,,,,,,,,,,,,,,,,,
J01,"Organizations whose activities focus on influencing public policy within the Employment, Job Related major group area. Includes a variety of activities from public education and influencing public opinion to lobbying national and state legislatures.",Alliances & Advocacy,Lobbying,Public Awareness,,,,,,,,,,,,,,,,,,,,,,,,,,,,,,,,,,,,,,,,,,,,,,,,,,,,,,,,,,,,,,,,,,,,,,,,,,,,,,,,,,,,,,,,,,,,,,,,,,,,,,,,,,,,,,,,,,,,,,,,,,,,,,,,,,,,,,,,,,,,,,,,,,,,,,,,,,,,,,,,,,,,,,,,,,,,,,,,,,,,,,,,,,,,,,,,,,,,,,,,,,,,,,,,,,,,,,,,,,,,,,,
J02,"Consultation, training, and other forms of management assistance services to nonprofit groups within the Employment, Job Related major group area.",Management & Technical Assistance,Professional Continuing Education,,,,,,,,,,,,,,,,,,,,,,,,,,,,,,,,,,,,,,,,,,,,,,,,,,,,,,,,,,,,,,,,,,,,,,,,,,,,,,,,,,,,,,,,,,,,,,,,,,,,,,,,,,,,,,,,,,,,,,,,,,,,,,,,,,,,,,,,,,,,,,,,,,,,,,,,,,,,,,,,,,,,,,,,,,,,,,,,,,,,,,,,,,,,,,,,,,,,,,,,,,,,,,,,,,,,,,,,,,,,,,,,
J03,"Learned societies, professional councils, and other organizations that bring together individuals or organizations with a common professional or vocational interest within the Employment, Job Related major group area.",Professional Societies & Associations,,,,,,,,,,,,,,,,,,,,,,,,,,,,,,,,,,,,,,,,,,,,,,,,,,,,,,,,,,,,,,,,,,,,,,,,,,,,,,,,,,,,,,,,,,,,,,,,,,,,,,,,,,,,,,,,,,,,,,,,,,,,,,,,,,,,,,,,,,,,,,,,,,,,,,,,,,,,,,,,,,,,,,,,,,,,,,,,,,,,,,,,,,,,,,,,,,,,,,,,,,,,,,,,,,,,,,,,,,,,,,,,,
J05,"Organizations whose primary purpose is to conduct research and/or public policy analysis within the Employment, Job Related major group area.",Research Institutes & Public Policy Analysis,Employment Policy,Employment Research,,,,,,,,,,,,,,,,,,,,,,,,,,,,,,,,,,,,,,,,,,,,,,,,,,,,,,,,,,,,,,,,,,,,,,,,,,,,,,,,,,,,,,,,,,,,,,,,,,,,,,,,,,,,,,,,,,,,,,,,,,,,,,,,,,,,,,,,,,,,,,,,,,,,,,,,,,,,,,,,,,,,,,,,,,,,,,,,,,,,,,,,,,,,,,,,,,,,,,,,,,,,,,,,,,,,,,,,,,,,,,,
J11,Organizations existing as a fund-raising entity for a single institution within the Employment major group area.,Single Organization Support,,,,,,,,,,,,,,,,,,,,,,,,,,,,,,,,,,,,,,,,,,,,,,,,,,,,,,,,,,,,,,,,,,,,,,,,,,,,,,,,,,,,,,,,,,,,,,,,,,,,,,,,,,,,,,,,,,,,,,,,,,,,,,,,,,,,,,,,,,,,,,,,,,,,,,,,,,,,,,,,,,,,,,,,,,,,,,,,,,,,,,,,,,,,,,,,,,,,,,,,,,,,,,,,,,,,,,,,,,,,,,,,,
J12,"Organizations that raise and distribute funds for multiple organizations within the Employment, Job Related major group area.",Fund Raising & Fund Distribution,,,,,,,,,,,,,,,,,,,,,,,,,,,,,,,,,,,,,,,,,,,,,,,,,,,,,,,,,,,,,,,,,,,,,,,,,,,,,,,,,,,,,,,,,,,,,,,,,,,,,,,,,,,,,,,,,,,,,,,,,,,,,,,,,,,,,,,,,,,,,,,,,,,,,,,,,,,,,,,,,,,,,,,,,,,,,,,,,,,,,,,,,,,,,,,,,,,,,,,,,,,,,,,,,,,,,,,,,,,,,,,,,
J19,"Organizations that provide all forms of support except for financial assistance or fund raising for other organizations within the Employment, Job Related major group area.",Support N.E.C.,,,,,,,,,,,,,,,,,,,,,,,,,,,,,,,,,,,,,,,,,,,,,,,,,,,,,,,,,,,,,,,,,,,,,,,,,,,,,,,,,,,,,,,,,,,,,,,,,,,,,,,,,,,,,,,,,,,,,,,,,,,,,,,,,,,,,,,,,,,,,,,,,,,,,,,,,,,,,,,,,,,,,,,,,,,,,,,,,,,,,,,,,,,,,,,,,,,,,,,,,,,,,,,,,,,,,,,,,,,,,,,,,
J20,"Organizations that help people prepare for, find, secure and retain suitable employment. Use this code for organizations that provide a wide range of employment services or those that offer employment-related services not specified below. Includes: Employment placement agencies; Job development organizations including those for youth and people with disabilities; Retraining; and Senior Community Service Employment Programs ",Employment Preparation & Procurement,Bonding for Employment,Business Attire,Dislocated Workers Training,Displaced Homemakers,Dress for Success,Employment Acquisition,Employment Agencies,Employment Placement Agencies,Employment Preparation,Employment Procurement,Employment Referrals,Employment Resource Center,Employment Retraining,Employment Screening/Finding,Equal Employment Opportunity,Foreign Employment,Job Banks,Job Clubs,Job Counseling and Placement,Job Fairs,Job Information Clearinghouses,Job Information Lines,Job Interview Training,Job Listings,Job Placement Assistance,Job Readiness,Job Referrals,Job Search Assistance,Job Search Resource Center,Occupational Retraining,Occupational Training for Dislocated Workers,OICs,Opportunities Industrialization Centers,Post Employment Assistance,Pre-Job Guidance,Reentry Training,Resume Preparation Assistance,Retraining,SCSEP,Senior Citizen Employment,Senior Community Service Employment,SER-Jobs for Progress,Title V,Work Reentry Training,,,,,,,,,,,,,,,,,,,,,,,,,,,,,,,,,,,,,,,,,,,,,,,,,,,,,,,,,,,,,,,,,,,,,,,,,,,,,,,,,,,,,,,,,,,,,,,,,,,,,,,,,,,,,,,,,,,,,,,,,,,,,,,,,,,,,,,,,,,,,,,,,,,,,,,,,,,,,,,,,,,,,,,,,,,,,,,,,,,,,
J21,"Organizations that administer tests which measure the skills, abilities and interests of job seekers and help them make appropriate decisions regarding an occupational field or position.",Vocational Counseling,Assessment Testing,Career Awareness,Career Counseling,Career Development,Career Goals,Career Guidance,Career Planning,Employment Aptitude Testing,Employment Counseling,Employment Interest Measures,Interest Inventories,Job Counseling,Vocational Assessment,Vocational Counseling,Vocational Guidance,Vocational Information,Vocational Testing,,,,,,,,,,,,,,,,,,,,,,,,,,,,,,,,,,,,,,,,,,,,,,,,,,,,,,,,,,,,,,,,,,,,,,,,,,,,,,,,,,,,,,,,,,,,,,,,,,,,,,,,,,,,,,,,,,,,,,,,,,,,,,,,,,,,,,,,,,,,,,,,,,,,,,,,,,,,,,,,,,,,,,,,,,,,,,,,,,,,,,,,,,,,,,,,,,,,,,,,,,,,,,,,
J22,Organizations that train people in the specific skills they will need to obtain employment in a particular industry or which provide work experience for youth or others who have no employment history.,Job Training,Apprenticeship & Training Trusts,Apprenticeships,Community Work & Training,Employment Training,Field Experience,Industrial Training,In-service Training,Internships,Job Corps,Job Training,Jobs Training Partnership Act,JTPA,JTPA Summer,Manpower Training,Occupational Training,On-the-Job Training,Personnel Training,Practice Teaching,Practicums,Public Employment & Training,Residency,School to Career,School to Work,Senior Community Service Employment,Student Field Work,Summer Youth Employment,Title IIA,Title IIB,Title IIC,Welfare to Work,WIA,Work & Training,Work Experience,Workfare,Workforce Development,Workforce Investment Act,Youth Corps,Youth Job Training & Employment,,,,,,,,,,,,,,,,,,,,,,,,,,,,,,,,,,,,,,,,,,,,,,,,,,,,,,,,,,,,,,,,,,,,,,,,,,,,,,,,,,,,,,,,,,,,,,,,,,,,,,,,,,,,,,,,,,,,,,,,,,,,,,,,,,,,,,,,,,,,,,,,,,,,,,,,,,,,,,,,,,,,,,,,,,,,,,,,,,,,,,,,,,,
J30,"Organizations that provide job training and employment experiences for individuals with disabilities, people who have been disabled by use of drugs or alcohol or people with emotional difficulties, with the objective of helping them to become economically self-sufficient.",Vocational Rehabilitation,Employment for Disabled Persons,Employment for the Homebound,Homebound Employment,Housebound Employment,Job Coach,On-the-Job Coaching,Supported Employment,Work Adjustment Training,,,,,,,,,,,,,,,,,,,,,,,,,,,,,,,,,,,,,,,,,,,,,,,,,,,,,,,,,,,,,,,,,,,,,,,,,,,,,,,,,,,,,,,,,,,,,,,,,,,,,,,,,,,,,,,,,,,,,,,,,,,,,,,,,,,,,,,,,,,,,,,,,,,,,,,,,,,,,,,,,,,,,,,,,,,,,,,,,,,,,,,,,,,,,,,,,,,,,,,,,,,,,,,,,,,,,,,,,
J32,Goodwill Industries sites.,Goodwill Industries,,,,,,,,,,,,,,,,,,,,,,,,,,,,,,,,,,,,,,,,,,,,,,,,,,,,,,,,,,,,,,,,,,,,,,,,,,,,,,,,,,,,,,,,,,,,,,,,,,,,,,,,,,,,,,,,,,,,,,,,,,,,,,,,,,,,,,,,,,,,,,,,,,,,,,,,,,,,,,,,,,,,,,,,,,,,,,,,,,,,,,,,,,,,,,,,,,,,,,,,,,,,,,,,,,,,,,,,,,,,,,,,,
J33,"Organizations that provide paid employment opportunities in a controlled, protected environment for people with disabilities who are unable to obtain competitive employment. Also included are work activity centers which provide personal and social development opportunities for participants who have demonstrated inconsequential production capacity.",Sheltered Employment,Remunerative Sheltered Employment,Sheltered Employment,Sheltered Remunerative Employment,Sheltered Work Activity Centers,Sheltered Workshops,,,,,,,,,,,,,,,,,,,,,,,,,,,,,,,,,,,,,,,,,,,,,,,,,,,,,,,,,,,,,,,,,,,,,,,,,,,,,,,,,,,,,,,,,,,,,,,,,,,,,,,,,,,,,,,,,,,,,,,,,,,,,,,,,,,,,,,,,,,,,,,,,,,,,,,,,,,,,,,,,,,,,,,,,,,,,,,,,,,,,,,,,,,,,,,,,,,,,,,,,,,,,,,,,,,,,,,,,,,,
J40,Organizations that work to promote the rights of employees to fair remuneration and safe working conditions [Note: These are generally section 501(c)(5) organizations]. ,Labor Unions,Associations of Employees,Associations of Municipal Employees,Employyee Associations,Employee Clubs,Fair Labor Standards,Farm Workers,Labor,Labor Unions,Local Unions,Longshoremen,Migrant Workers,Safe Working Conditions,Teamsters,Wage Policies,"Wage, Hour & Workplace Standards",Working Conditions,Trade Unions,,,,,,,,,,,,,,,,,,,,,,,,,,,,,,,,,,,,,,,,,,,,,,,,,,,,,,,,,,,,,,,,,,,,,,,,,,,,,,,,,,,,,,,,,,,,,,,,,,,,,,,,,,,,,,,,,,,,,,,,,,,,,,,,,,,,,,,,,,,,,,,,,,,,,,,,,,,,,,,,,,,,,,,,,,,,,,,,,,,,,,,,,,,,,,,,,,,,,,,,,,,,,,,,
J99,Use this code for organizations that clearly provide employment and job related services where the major purpose is unclear enough that a more specific code cannot be accurately assigned.,Employment N.E.C.,,,,,,,,,,,,,,,,,,,,,,,,,,,,,,,,,,,,,,,,,,,,,,,,,,,,,,,,,,,,,,,,,,,,,,,,,,,,,,,,,,,,,,,,,,,,,,,,,,,,,,,,,,,,,,,,,,,,,,,,,,,,,,,,,,,,,,,,,,,,,,,,,,,,,,,,,,,,,,,,,,,,,,,,,,,,,,,,,,,,,,,,,,,,,,,,,,,,,,,,,,,,,,,,,,,,,,,,,,,,,,,,,
K,,"Food, Agriculture & Nutrition",,,,,,,,,,,,,,,,,,,,,,,,,,,,,,,,,,,,,,,,,,,,,,,,,,,,,,,,,,,,,,,,,,,,,,,,,,,,,,,,,,,,,,,,,,,,,,,,,,,,,,,,,,,,,,,,,,,,,,,,,,,,,,,,,,,,,,,,,,,,,,,,,,,,,,,,,,,,,,,,,,,,,,,,,,,,,,,,,,,,,,,,,,,,,,,,,,,,,,,,,,,,,,,,,,,,,,,,,,,,,,,,,
K01,"Organizations whose activities focus on influencing public policy within the Food, Agriculture, and Nutrition major group area. Includes a variety of activities from public education and influencing public opinion to lobbying national and state legislatures.",Alliances & Advocacy,Agrarian Reform,Anti-Hunger Alliances,Anti-Hunger Coalitions,Hunger Action,Lobbying,Public Awareness,,,,,,,,,,,,,,,,,,,,,,,,,,,,,,,,,,,,,,,,,,,,,,,,,,,,,,,,,,,,,,,,,,,,,,,,,,,,,,,,,,,,,,,,,,,,,,,,,,,,,,,,,,,,,,,,,,,,,,,,,,,,,,,,,,,,,,,,,,,,,,,,,,,,,,,,,,,,,,,,,,,,,,,,,,,,,,,,,,,,,,,,,,,,,,,,,,,,,,,,,,,,,,,,,,,,,,,,,,,
K02,"Consultation, training, and other forms of management assistance services to nonprofit groups within the Food, Agriculture, and Nutrition major group area.",Management & Technical Assistance,Farm Management & Technical Assistance,Professional Continuing Education,,,,,,,,,,,,,,,,,,,,,,,,,,,,,,,,,,,,,,,,,,,,,,,,,,,,,,,,,,,,,,,,,,,,,,,,,,,,,,,,,,,,,,,,,,,,,,,,,,,,,,,,,,,,,,,,,,,,,,,,,,,,,,,,,,,,,,,,,,,,,,,,,,,,,,,,,,,,,,,,,,,,,,,,,,,,,,,,,,,,,,,,,,,,,,,,,,,,,,,,,,,,,,,,,,,,,,,,,,,,,,,
K03,"Learned societies, professional councils, and other organizations that bring together individuals or organizations with a common professional or vocational interest within the Food, Agriculture, and Nutrition major group area.",Professional Societies & Associations,,,,,,,,,,,,,,,,,,,,,,,,,,,,,,,,,,,,,,,,,,,,,,,,,,,,,,,,,,,,,,,,,,,,,,,,,,,,,,,,,,,,,,,,,,,,,,,,,,,,,,,,,,,,,,,,,,,,,,,,,,,,,,,,,,,,,,,,,,,,,,,,,,,,,,,,,,,,,,,,,,,,,,,,,,,,,,,,,,,,,,,,,,,,,,,,,,,,,,,,,,,,,,,,,,,,,,,,,,,,,,,,,
K05,"Organizations whose primary purpose is to conduct research and/or public policy analysis within the Food, Agriculture, and Nutrition major group area.",Research Institutes & Public Policy Analysis,Agricultural Policy Research & Analysis,Agricultural Science Research Institutes,Food Policy Research & Analysis,Food Science Research Institutes,,,,,,,,,,,,,,,,,,,,,,,,,,,,,,,,,,,,,,,,,,,,,,,,,,,,,,,,,,,,,,,,,,,,,,,,,,,,,,,,,,,,,,,,,,,,,,,,,,,,,,,,,,,,,,,,,,,,,,,,,,,,,,,,,,,,,,,,,,,,,,,,,,,,,,,,,,,,,,,,,,,,,,,,,,,,,,,,,,,,,,,,,,,,,,,,,,,,,,,,,,,,,,,,,,,,,,,,,,,,,
K11,"Organizations existing as a fund-raising entity for a single institution within the Food, Agriculture & Nutrition major group area.",Single Organization Support,,,,,,,,,,,,,,,,,,,,,,,,,,,,,,,,,,,,,,,,,,,,,,,,,,,,,,,,,,,,,,,,,,,,,,,,,,,,,,,,,,,,,,,,,,,,,,,,,,,,,,,,,,,,,,,,,,,,,,,,,,,,,,,,,,,,,,,,,,,,,,,,,,,,,,,,,,,,,,,,,,,,,,,,,,,,,,,,,,,,,,,,,,,,,,,,,,,,,,,,,,,,,,,,,,,,,,,,,,,,,,,,,
K12,"Organizations that raise and distribute funds for multiple organizations within the Food, Agriculture, and Nutrition major group area.",Fund Raising & Fund Distribution,,,,,,,,,,,,,,,,,,,,,,,,,,,,,,,,,,,,,,,,,,,,,,,,,,,,,,,,,,,,,,,,,,,,,,,,,,,,,,,,,,,,,,,,,,,,,,,,,,,,,,,,,,,,,,,,,,,,,,,,,,,,,,,,,,,,,,,,,,,,,,,,,,,,,,,,,,,,,,,,,,,,,,,,,,,,,,,,,,,,,,,,,,,,,,,,,,,,,,,,,,,,,,,,,,,,,,,,,,,,,,,,,
K19,"Organizations that provide all forms of support except for financial assistance or fund raising for other organizations within the Food, Agriculture and Nutrition major group area.",Support N.E.C.,,,,,,,,,,,,,,,,,,,,,,,,,,,,,,,,,,,,,,,,,,,,,,,,,,,,,,,,,,,,,,,,,,,,,,,,,,,,,,,,,,,,,,,,,,,,,,,,,,,,,,,,,,,,,,,,,,,,,,,,,,,,,,,,,,,,,,,,,,,,,,,,,,,,,,,,,,,,,,,,,,,,,,,,,,,,,,,,,,,,,,,,,,,,,,,,,,,,,,,,,,,,,,,,,,,,,,,,,,,,,,,,,
K20,Organizations that focus on the development and improvement of food resources or food procurement through information and technical assistance for agricultural establishments and individuals in rural or urban settings. Use this code for organizations that provide a wide range of agricultural services or those that offer services to support the agricultural sector not specified below.,Agricultural Programs,Agricultural Cooperatives,Agricultural Extension Service,Agricultural Production,Agricultural Water Management,Agroforestry,Alternative Farming,Aquaculture,Crop Production,Dairy Cooperatives,Erosion Control,Farmers Cooperative Marketing,Farmers Cooperative Purchasing,Fish Farming,Home Gardening Assistance,Irrigation,Organic Farming,Pest Control,Regenerative Agriculture,Seed Certification,Soil Conservation,Soil Erosion Prevention,Sustainable Agriculture,Sustainable Farming,,,,,,,,,,,,,,,,,,,,,,,,,,,,,,,,,,,,,,,,,,,,,,,,,,,,,,,,,,,,,,,,,,,,,,,,,,,,,,,,,,,,,,,,,,,,,,,,,,,,,,,,,,,,,,,,,,,,,,,,,,,,,,,,,,,,,,,,,,,,,,,,,,,,,,,,,,,,,,,,,,,,,,,,,,,,,,,,,,,,,,,,,,,,,,,,,,,,,,,,,,
K25,Organizations such as land trusts that work to ensure that farmland is preserved for farming purposes rather than freed for development or environmental quality purposes.,Farmland Preservation,Agricultural Land Preservation,Agricultural Land Protection,Farmland Protection,Working Farms Preservation,,,,,,,,,,,,,,,,,,,,,,,,,,,,,,,,,,,,,,,,,,,,,,,,,,,,,,,,,,,,,,,,,,,,,,,,,,,,,,,,,,,,,,,,,,,,,,,,,,,,,,,,,,,,,,,,,,,,,,,,,,,,,,,,,,,,,,,,,,,,,,,,,,,,,,,,,,,,,,,,,,,,,,,,,,,,,,,,,,,,,,,,,,,,,,,,,,,,,,,,,,,,,,,,,,,,,,,,,,,,,
K26,"Organizations that provide information, technical assistance and support for individuals or commercial establishments that are engaged in the keeping, grazing, feeding and/or sale of livestock. [Note: These organizations are typically found in section 501(c)(5).]",Animal Husbandry,Animal Breeding,Animal Husbandry,Apiaries,Apiculture,Beekeeping,Breeders Associations,Breeding,Cattle,Dairy Farms,Dairy Herd Improvement Association,Egg Production Facilities,Farm Animals,Feedlots,Goats,Hogs,Horse Breeding,Husbandry,Livestock Breeding,Poultry,Poultry Hatcheries,Ranches,Sericulture,Sheep,Silkworms,Turkeys,,,,,,,,,,,,,,,,,,,,,,,,,,,,,,,,,,,,,,,,,,,,,,,,,,,,,,,,,,,,,,,,,,,,,,,,,,,,,,,,,,,,,,,,,,,,,,,,,,,,,,,,,,,,,,,,,,,,,,,,,,,,,,,,,,,,,,,,,,,,,,,,,,,,,,,,,,,,,,,,,,,,,,,,,,,,,,,,,,,,,,,,,,,,,,,,,,,,,,,,
K28,Organizations whose members are farmers or ranchers who have affiliated for the purpose of representing the interests of agricultural producers and rural communities. [Note: These organizations are typically found in section 501(c)(5).],Farm Bureaus & Granges,Agricultural Societies,Farm Bureaus,Farmers Associations,Granges,,,,,,,,,,,,,,,,,,,,,,,,,,,,,,,,,,,,,,,,,,,,,,,,,,,,,,,,,,,,,,,,,,,,,,,,,,,,,,,,,,,,,,,,,,,,,,,,,,,,,,,,,,,,,,,,,,,,,,,,,,,,,,,,,,,,,,,,,,,,,,,,,,,,,,,,,,,,,,,,,,,,,,,,,,,,,,,,,,,,,,,,,,,,,,,,,,,,,,,,,,,,,,,,,,,,,,,,,,,,,
K30,"Organizations that provide access to free or low-cost food products to children, seniors, or indigents by distributing groceries, providing meals, providing facilities for storing food or making available land on which people can grow their own produce. Use this code for organizations that provide a wide range of food services or those that offer food-related services not specified below.",Food Programs,Baby Food Suppliers,Commodity Distribution,Community Food Gardening,Cooperative Food Purchasing,Emergency Food,Farmers Markets,Food Aid,Food Assistance,Food Baskets,Food Cooperatives,Food Co-ops,Food Distribution,Food Gleaning,Food Lines,Food Vouchers,Groceries on Wheels,Grocery Vouchers,,,,,,,,,,,,,,,,,,,,,,,,,,,,,,,,,,,,,,,,,,,,,,,,,,,,,,,,,,,,,,,,,,,,,,,,,,,,,,,,,,,,,,,,,,,,,,,,,,,,,,,,,,,,,,,,,,,,,,,,,,,,,,,,,,,,,,,,,,,,,,,,,,,,,,,,,,,,,,,,,,,,,,,,,,,,,,,,,,,,,,,,,,,,,,,,,,,,,,,,,,,,,,,,
K31,"Organizations that gather, store and distribute food to indigents at no charge or at low cost.",Food Banks & Pantries,Food Banks,Food Clearinghouse,Food Closet,Food Outlets,Food Pantries,food pantry,Food Supplement Distribution,Free Food Distribution,Surplus Commodity Distribution,,,,,,,,,,,,,,,,,,,,,,,,,,,,,,,,,,,,,,,,,,,,,,,,,,,,,,,,,,,,,,,,,,,,,,,,,,,,,,,,,,,,,,,,,,,,,,,,,,,,,,,,,,,,,,,,,,,,,,,,,,,,,,,,,,,,,,,,,,,,,,,,,,,,,,,,,,,,,,,,,,,,,,,,,,,,,,,,,,,,,,,,,,,,,,,,,,,,,,,,,,,,,,,,,,,,,,,,
K34,"Organizations (also known as nutrition sites or senior nutrition programs) that provide hot meals on a regular basis, usually for elderly individuals but also for disabled adults or other target populations.",Congregate Meals,Adult Care Feeding,Child Care Feeding,Child Nutrition,Group Meals,Low-Cost Meals,Meal Vouchers,Milk Programs,Nutrition Sites,School Breakfasts,School Lunches,Summer Food Service,Senior Nutrition Sites,,,,,,,,,,,,,,,,,,,,,,,,,,,,,,,,,,,,,,,,,,,,,,,,,,,,,,,,,,,,,,,,,,,,,,,,,,,,,,,,,,,,,,,,,,,,,,,,,,,,,,,,,,,,,,,,,,,,,,,,,,,,,,,,,,,,,,,,,,,,,,,,,,,,,,,,,,,,,,,,,,,,,,,,,,,,,,,,,,,,,,,,,,,,,,,,,,,,,,,,,,,,,,,,,,,,,
K35,Organizations that provide meals in a central location for indigent people.,Soup Kitchens,Homeless Meals,Meals for Homeless People,Soup Kitchens,,,,,,,,,,,,,,,,,,,,,,,,,,,,,,,,,,,,,,,,,,,,,,,,,,,,,,,,,,,,,,,,,,,,,,,,,,,,,,,,,,,,,,,,,,,,,,,,,,,,,,,,,,,,,,,,,,,,,,,,,,,,,,,,,,,,,,,,,,,,,,,,,,,,,,,,,,,,,,,,,,,,,,,,,,,,,,,,,,,,,,,,,,,,,,,,,,,,,,,,,,,,,,,,,,,,,,,,,,,,,,
K36,"Organizations that prepare and deliver regular hot meals to elderly individuals, people with disabilities or people with AIDS or other targeted conditions who are unable to shop and/or prepare food for themselves or to travel to a site where a meal is being served. Also known as home delivered meals.",Meals on Wheels,Home Delivered Meals,Home Meals,Meals on Wheels,Mobile Meals,,,,,,,,,,,,,,,,,,,,,,,,,,,,,,,,,,,,,,,,,,,,,,,,,,,,,,,,,,,,,,,,,,,,,,,,,,,,,,,,,,,,,,,,,,,,,,,,,,,,,,,,,,,,,,,,,,,,,,,,,,,,,,,,,,,,,,,,,,,,,,,,,,,,,,,,,,,,,,,,,,,,,,,,,,,,,,,,,,,,,,,,,,,,,,,,,,,,,,,,,,,,,,,,,,,,,,,,,,,,,
K40,"Organizations that provide information concerning the basic principles of healthful eating, food handling, food preparation and shopping skills. Included is information about the basic food groups, vitamin and mineral requirements, and the relationship of nutrition to the preservation of good health and the prevention of illness.",Nutrition,Basic Food Groups,Healthful Eating,Nutrition Assistance,Nutrition Education,"Special Supplemental Nutrition for Women, Infants and Children",USDA Food Pyramid,Vegetarianism.,WIC,,,,,,,,,,,,,,,,,,,,,,,,,,,,,,,,,,,,,,,,,,,,,,,,,,,,,,,,,,,,,,,,,,,,,,,,,,,,,,,,,,,,,,,,,,,,,,,,,,,,,,,,,,,,,,,,,,,,,,,,,,,,,,,,,,,,,,,,,,,,,,,,,,,,,,,,,,,,,,,,,,,,,,,,,,,,,,,,,,,,,,,,,,,,,,,,,,,,,,,,,,,,,,,,,,,,,,,,,
K50,"Organizations that provide instruction that deals with the basic activities of homemaking including caring for and managing children, shopping for and preparing nutritious meals, maintaining a clean and safe living environment, and other in-home responsibilities.",Home Economics,Family Life,Homemaking,Housekeeping,,,,,,,,,,,,,,,,,,,,,,,,,,,,,,,,,,,,,,,,,,,,,,,,,,,,,,,,,,,,,,,,,,,,,,,,,,,,,,,,,,,,,,,,,,,,,,,,,,,,,,,,,,,,,,,,,,,,,,,,,,,,,,,,,,,,,,,,,,,,,,,,,,,,,,,,,,,,,,,,,,,,,,,,,,,,,,,,,,,,,,,,,,,,,,,,,,,,,,,,,,,,,,,,,,,,,,,,,,,,,,
K99,"Use this code for organizations that clearly provide food, agriculture or nutrition services where the major purpose is unclear enough that a more specific code cannot be accurately assigned.","Food, Agriculture & Nutrition N.E.C.",,,,,,,,,,,,,,,,,,,,,,,,,,,,,,,,,,,,,,,,,,,,,,,,,,,,,,,,,,,,,,,,,,,,,,,,,,,,,,,,,,,,,,,,,,,,,,,,,,,,,,,,,,,,,,,,,,,,,,,,,,,,,,,,,,,,,,,,,,,,,,,,,,,,,,,,,,,,,,,,,,,,,,,,,,,,,,,,,,,,,,,,,,,,,,,,,,,,,,,,,,,,,,,,,,,,,,,,,,,,,,,,,
L,,Housing & Shelter,,,,,,,,,,,,,,,,,,,,,,,,,,,,,,,,,,,,,,,,,,,,,,,,,,,,,,,,,,,,,,,,,,,,,,,,,,,,,,,,,,,,,,,,,,,,,,,,,,,,,,,,,,,,,,,,,,,,,,,,,,,,,,,,,,,,,,,,,,,,,,,,,,,,,,,,,,,,,,,,,,,,,,,,,,,,,,,,,,,,,,,,,,,,,,,,,,,,,,,,,,,,,,,,,,,,,,,,,,,,,,,,,
