Q38,Organizations whose primary purpose is to protect the environment and create a sustainable world by addressing issues such as cross national concerns and advocacy and research on environmental and population policy.,"International Environment, Population & Sustainability ",Environmental and Population Policy,International Environmental Resource Management,International Family Planning,International Sustainable Development,Population Control,Global Warming,,,,,,,,,,,,,,,,,,,,,,,,,,,,,,,,,,,,,,,,,,,,,,,,,,,,,,,,,,,,,,,,,,,,,,,,,,,,,,,,,,,,,,,,,,,,,,,,,,,,,,,,,,,,,,,,,,,,,,,,,,,,,,,,,,,,,,,,,,,,,,,,,,,,,,,,,,,,,,,,,,,,,,,,,,,,,,,,,,,,,,,,,,,,,,,,,,,,,,,,,,,,,,,,,,,,,,,,,,,
Q39,"Organizations whose primary purpose is to provide health assistance and training, loans and loan guarantees, financial and other material support for hospitals, medical services for countries outside the United States.",International Health Development ,,,,,,,,,,,,,,,,,,,,,,,,,,,,,,,,,,,,,,,,,,,,,,,,,,,,,,,,,,,,,,,,,,,,,,,,,,,,,,,,,,,,,,,,,,,,,,,,,,,,,,,,,,,,,,,,,,,,,,,,,,,,,,,,,,,,,,,,,,,,,,,,,,,,,,,,,,,,,,,,,,,,,,,,,,,,,,,,,,,,,,,,,,,,,,,,,,,,,,,,,,,,,,,,,,,,,,,,,,,,,,,,,
Q40,Organizations that promote harmony and understanding among nations either globally or in a particular region of the world and/or engage in activities that promote peaceful ways of managing and settling international conflicts. Use this code for organizations that promote international peace in a general way or which have specific programs devoted to international peace and security other than those specified below.,International Peace & Security,Antiwar Movements,Diplomacy,International Conflict Mediation,International Conflict Resolution,International Peace,International Security,Peace Movements,Peace Studies,,,,,,,,,,,,,,,,,,,,,,,,,,,,,,,,,,,,,,,,,,,,,,,,,,,,,,,,,,,,,,,,,,,,,,,,,,,,,,,,,,,,,,,,,,,,,,,,,,,,,,,,,,,,,,,,,,,,,,,,,,,,,,,,,,,,,,,,,,,,,,,,,,,,,,,,,,,,,,,,,,,,,,,,,,,,,,,,,,,,,,,,,,,,,,,,,,,,,,,,,,,,,,,,,,,,,,,,,
Q41,"Organizations that promote control of nuclear, biological, chemical and conventional weapons development and proliferation.",Arms Control & Peace,Arms Control,Biological Weapons Control,Chemical Weapons Control,Disarmament Issues,Nuclear Arms,Nuclear Freeze,Nuclear War,Nuclear Weapons Non-Proliferation,Nuclear Weapons Reduction,Strategic Arms Reduction,Weapons Control,Weapons Reduction,Weapons Testing,,,,,,,,,,,,,,,,,,,,,,,,,,,,,,,,,,,,,,,,,,,,,,,,,,,,,,,,,,,,,,,,,,,,,,,,,,,,,,,,,,,,,,,,,,,,,,,,,,,,,,,,,,,,,,,,,,,,,,,,,,,,,,,,,,,,,,,,,,,,,,,,,,,,,,,,,,,,,,,,,,,,,,,,,,,,,,,,,,,,,,,,,,,,,,,,,,,,,,,,,,,,,,,,,,,,
Q42,Organizations whose activities relate specifically to the United Nations.,United Nations Associations,United Nations,,,,,,,,,,,,,,,,,,,,,,,,,,,,,,,,,,,,,,,,,,,,,,,,,,,,,,,,,,,,,,,,,,,,,,,,,,,,,,,,,,,,,,,,,,,,,,,,,,,,,,,,,,,,,,,,,,,,,,,,,,,,,,,,,,,,,,,,,,,,,,,,,,,,,,,,,,,,,,,,,,,,,,,,,,,,,,,,,,,,,,,,,,,,,,,,,,,,,,,,,,,,,,,,,,,,,,,,,,,,,,,,
Q43,"Organizations that conduct studies on major national security topics including the U.S. armed forces, weapons decisions, deployment policies and the security aspects of U.S. foreign relations; monitor legislation on national security issues; advocate for specific defense policies and expenditures; and engage in other activities related to the security of the United States.",National Security,National Security,,,,,,,,,,,,,,,,,,,,,,,,,,,,,,,,,,,,,,,,,,,,,,,,,,,,,,,,,,,,,,,,,,,,,,,,,,,,,,,,,,,,,,,,,,,,,,,,,,,,,,,,,,,,,,,,,,,,,,,,,,,,,,,,,,,,,,,,,,,,,,,,,,,,,,,,,,,,,,,,,,,,,,,,,,,,,,,,,,,,,,,,,,,,,,,,,,,,,,,,,,,,,,,,,,,,,,,,,,,,,,,,
Q50,"Organizations that conduct studies on foreign policy, national security, regional affairs and international energy, economic, and trade policies; monitor foreign policy legislation; hold conferences seminars and debates to expand interest in international issues and promote understanding of US foreign policy and international affairs; address problems of globalization; publish journals, newsletters, and other materials addressing foreign policy issues; and engage in other activities relating to foreign policy.","International Affairs, Foreign Policy, & Globalization",Foreign Affairs,Foreign Relations,Globalization,International Law,International Relations,,,,,,,,,,,,,,,,,,,,,,,,,,,,,,,,,,,,,,,,,,,,,,,,,,,,,,,,,,,,,,,,,,,,,,,,,,,,,,,,,,,,,,,,,,,,,,,,,,,,,,,,,,,,,,,,,,,,,,,,,,,,,,,,,,,,,,,,,,,,,,,,,,,,,,,,,,,,,,,,,,,,,,,,,,,,,,,,,,,,,,,,,,,,,,,,,,,,,,,,,,,,,,,,,,,,,,,,,,,,
Q51,"Organizations whose primary purpose is promote world trade and strengthen international trade and investment position of the US, states and localities. Services may include analyses of the competitiveness of specific industries, development of trade policies, negotiating market access for US companies and promoting exports through trade missions, shows, and fairs in major overseas markets.",International Economic & Trade Policy,International Investment,International Markets,Common Market,Emerging Markets,European Market,Exports,Foreign Trade,GATT,Global Markets,Imports,International Business Development,International Development,International Economic Relations,International Trade Programs,International Trade,Microenterprise,NAFTA,Overseas Trade,Trade Agreements,Trade Protection,,,,,,,,,,,,,,,,,,,,,,,,,,,,,,,,,,,,,,,,,,,,,,,,,,,,,,,,,,,,,,,,,,,,,,,,,,,,,,,,,,,,,,,,,,,,,,,,,,,,,,,,,,,,,,,,,,,,,,,,,,,,,,,,,,,,,,,,,,,,,,,,,,,,,,,,,,,,,,,,,,,,,,,,,,,,,,,,,,,,,,,,,,,,,,,,,,,,,,,,,,,,,
Q70,"Organizations that work to protect individuals around the world from denial of civil rights and liberties or other arbitrary governmental interference, harassment, or abuse due to their political or religious beliefs.",International Human Rights,International Childrens Rights,International Human Rights Violations,"International Prisoners Rights, International Reproductive Rights",International Womens Rights,Legal Rights,Political Prisoners,Political Repression,War Crimes,,,,,,,,,,,,,,,,,,,,,,,,,,,,,,,,,,,,,,,,,,,,,,,,,,,,,,,,,,,,,,,,,,,,,,,,,,,,,,,,,,,,,,,,,,,,,,,,,,,,,,,,,,,,,,,,,,,,,,,,,,,,,,,,,,,,,,,,,,,,,,,,,,,,,,,,,,,,,,,,,,,,,,,,,,,,,,,,,,,,,,,,,,,,,,,,,,,,,,,,,,,,,,,,,,,,,,,,,
Q71,Organizations that monitor and inform the public about the world refugee situation; review refugee-related legislation; and advocate for specific policies relating to the plight of refugees in other countries. Also included are organizations that raise money to enable refugees to leave their own countries and migrate to foreign countries of their choice; or provide aid to refugees who have left their country of origin and are residing in another country outside the United States.,International Migration & Refugee Issues,Asylum Seekers,Displaced Persons,International Migration,International Refugees,Political Asylum,War Victims,,,,,,,,,,,,,,,,,,,,,,,,,,,,,,,,,,,,,,,,,,,,,,,,,,,,,,,,,,,,,,,,,,,,,,,,,,,,,,,,,,,,,,,,,,,,,,,,,,,,,,,,,,,,,,,,,,,,,,,,,,,,,,,,,,,,,,,,,,,,,,,,,,,,,,,,,,,,,,,,,,,,,,,,,,,,,,,,,,,,,,,,,,,,,,,,,,,,,,,,,,,,,,,,,,,,,,,,,,,
Q99,Use this code for organizations that clearly provide services related to international affairs where the major purpose is unclear enough that a more specific code cannot be accurately assigned.,"International, Foreign Affairs & National Security N.E.C.",,,,,,,,,,,,,,,,,,,,,,,,,,,,,,,,,,,,,,,,,,,,,,,,,,,,,,,,,,,,,,,,,,,,,,,,,,,,,,,,,,,,,,,,,,,,,,,,,,,,,,,,,,,,,,,,,,,,,,,,,,,,,,,,,,,,,,,,,,,,,,,,,,,,,,,,,,,,,,,,,,,,,,,,,,,,,,,,,,,,,,,,,,,,,,,,,,,,,,,,,,,,,,,,,,,,,,,,,,,,,,,,,
R,"Private nonprofit organizations whose primary purpose is to protect and promote the broad civil rights of groups and civil liberties of individuals, to work for the realization of specific social or political goals or to encourage the participation of people in the public policy debate.","Civil Rights, Social Action & Advocacy",,,,,,,,,,,,,,,,,,,,,,,,,,,,,,,,,,,,,,,,,,,,,,,,,,,,,,,,,,,,,,,,,,,,,,,,,,,,,,,,,,,,,,,,,,,,,,,,,,,,,,,,,,,,,,,,,,,,,,,,,,,,,,,,,,,,,,,,,,,,,,,,,,,,,,,,,,,,,,,,,,,,,,,,,,,,,,,,,,,,,,,,,,,,,,,,,,,,,,,,,,,,,,,,,,,,,,,,,,,,,,,,,
R01,"Organizations whose activities focus on influencing public policy within the Civil Rights, Social Action, Advocacy major group area. Includes a variety of activities from public education and influencing public opinion to lobbying national and state legislatures.",Alliances & Advocacy,Lobbying,Public Awareness,,,,,,,,,,,,,,,,,,,,,,,,,,,,,,,,,,,,,,,,,,,,,,,,,,,,,,,,,,,,,,,,,,,,,,,,,,,,,,,,,,,,,,,,,,,,,,,,,,,,,,,,,,,,,,,,,,,,,,,,,,,,,,,,,,,,,,,,,,,,,,,,,,,,,,,,,,,,,,,,,,,,,,,,,,,,,,,,,,,,,,,,,,,,,,,,,,,,,,,,,,,,,,,,,,,,,,,,,,,,,,,
R02,"Consultation, training, and other forms of management assistance services to nonprofit groups within the Civil Rights, Social Action, Advocacy major group area.",Management & Technical Assistance,,,,,,,,,,,,,,,,,,,,,,,,,,,,,,,,,,,,,,,,,,,,,,,,,,,,,,,,,,,,,,,,,,,,,,,,,,,,,,,,,,,,,,,,,,,,,,,,,,,,,,,,,,,,,,,,,,,,,,,,,,,,,,,,,,,,,,,,,,,,,,,,,,,,,,,,,,,,,,,,,,,,,,,,,,,,,,,,,,,,,,,,,,,,,,,,,,,,,,,,,,,,,,,,,,,,,,,,,,,,,,,,,
R03,"Learned societies, professional councils, and other organizations that bring together individuals or organizations with a common professional or vocational interest within the Civil Rights, Social Action, Advocacy major group area.",Professional Societies & Associations,,,,,,,,,,,,,,,,,,,,,,,,,,,,,,,,,,,,,,,,,,,,,,,,,,,,,,,,,,,,,,,,,,,,,,,,,,,,,,,,,,,,,,,,,,,,,,,,,,,,,,,,,,,,,,,,,,,,,,,,,,,,,,,,,,,,,,,,,,,,,,,,,,,,,,,,,,,,,,,,,,,,,,,,,,,,,,,,,,,,,,,,,,,,,,,,,,,,,,,,,,,,,,,,,,,,,,,,,,,,,,,,,
R05,"Organizations whose primary purpose is to conduct research and/or public policy analysis within the Civil Rights, Social Action, Advocacy major group area.",Research Institutes & Public Policy Analysis,,,,,,,,,,,,,,,,,,,,,,,,,,,,,,,,,,,,,,,,,,,,,,,,,,,,,,,,,,,,,,,,,,,,,,,,,,,,,,,,,,,,,,,,,,,,,,,,,,,,,,,,,,,,,,,,,,,,,,,,,,,,,,,,,,,,,,,,,,,,,,,,,,,,,,,,,,,,,,,,,,,,,,,,,,,,,,,,,,,,,,,,,,,,,,,,,,,,,,,,,,,,,,,,,,,,,,,,,,,,,,,,,
R11,"Organizations existing as a fund-raising entity for a single institution within the Civil Rights, Social Action & Advocacy major group area.",Single Organization Support,,,,,,,,,,,,,,,,,,,,,,,,,,,,,,,,,,,,,,,,,,,,,,,,,,,,,,,,,,,,,,,,,,,,,,,,,,,,,,,,,,,,,,,,,,,,,,,,,,,,,,,,,,,,,,,,,,,,,,,,,,,,,,,,,,,,,,,,,,,,,,,,,,,,,,,,,,,,,,,,,,,,,,,,,,,,,,,,,,,,,,,,,,,,,,,,,,,,,,,,,,,,,,,,,,,,,,,,,,,,,,,,,
R12,"Organizations that raise and distribute funds for multiple organizations within the Civil Rights, Social Action, Advocacy major group area.",Fund Raising & Fund Distribution,,,,,,,,,,,,,,,,,,,,,,,,,,,,,,,,,,,,,,,,,,,,,,,,,,,,,,,,,,,,,,,,,,,,,,,,,,,,,,,,,,,,,,,,,,,,,,,,,,,,,,,,,,,,,,,,,,,,,,,,,,,,,,,,,,,,,,,,,,,,,,,,,,,,,,,,,,,,,,,,,,,,,,,,,,,,,,,,,,,,,,,,,,,,,,,,,,,,,,,,,,,,,,,,,,,,,,,,,,,,,,,,,
R19,"Organizations that provide all forms of support except for financial assistance or fund raising for other organizations in the Civil Rights, Social Action, Advocacy major group area.",Support N.E.C.,,,,,,,,,,,,,,,,,,,,,,,,,,,,,,,,,,,,,,,,,,,,,,,,,,,,,,,,,,,,,,,,,,,,,,,,,,,,,,,,,,,,,,,,,,,,,,,,,,,,,,,,,,,,,,,,,,,,,,,,,,,,,,,,,,,,,,,,,,,,,,,,,,,,,,,,,,,,,,,,,,,,,,,,,,,,,,,,,,,,,,,,,,,,,,,,,,,,,,,,,,,,,,,,,,,,,,,,,,,,,,,,,
R20,Organizations that work for the passage and enforcement of laws or other social measures that will more effectively protect the rights of specific groups. Use this code for organizations that broadly address civil rights and advocacy issues or which focus on populations not specified below.,Civil Rights,Discrimination of Specific Groups,Equal Rights,Immigrant Rights,Legal Rights,Refugee Rights,,,,,,,,,,,,,,,,,,,,,,,,,,,,,,,,,,,,,,,,,,,,,,,,,,,,,,,,,,,,,,,,,,,,,,,,,,,,,,,,,,,,,,,,,,,,,,,,,,,,,,,,,,,,,,,,,,,,,,,,,,,,,,,,,,,,,,,,,,,,,,,,,,,,,,,,,,,,,,,,,,,,,,,,,,,,,,,,,,,,,,,,,,,,,,,,,,,,,,,,,,,,,,,,,,,,,,,,,,,,
R21,Organizations that support the passage and enforcement of laws and other social measures which protect the rights and interests of individuals who have newly arrived in the country or which govern the process by which individuals and families are granted permission to immigrate.,Immigrants' Rights,,,,,,,,,,,,,,,,,,,,,,,,,,,,,,,,,,,,,,,,,,,,,,,,,,,,,,,,,,,,,,,,,,,,,,,,,,,,,,,,,,,,,,,,,,,,,,,,,,,,,,,,,,,,,,,,,,,,,,,,,,,,,,,,,,,,,,,,,,,,,,,,,,,,,,,,,,,,,,,,,,,,,,,,,,,,,,,,,,,,,,,,,,,,,,,,,,,,,,,,,,,,,,,,,,,,,,,,,,,,,,,,,
R22,Organizations that support the passage and enforcement of laws and other social measures that protect and promote the rights and interests of one or more specific ethnic groups or individuals who have a common national origin. Use this code for organizations like the NAACP and La Raza.,Minority Rights,African American Rights,Asian American Rights,Congress of Racial Equality,CORE,Ethnic Groups Rights,Hispanic Rights,La Raza,Latino Rights,NAACP,Native American Rights,Racial Equality,SCLC,Southern Christian Leadership Conference,,,,,,,,,,,,,,,,,,,,,,,,,,,,,,,,,,,,,,,,,,,,,,,,,,,,,,,,,,,,,,,,,,,,,,,,,,,,,,,,,,,,,,,,,,,,,,,,,,,,,,,,,,,,,,,,,,,,,,,,,,,,,,,,,,,,,,,,,,,,,,,,,,,,,,,,,,,,,,,,,,,,,,,,,,,,,,,,,,,,,,,,,,,,,,,,,,,,,,,,,,,,,,,,,,,,
R23,"Organizations that support the passage and enforcement of laws or other social measures that protect the rights of people who have disabilities and maximize their ability to enjoy the same opportunities, resources and privileges as the mainstream population.",Disabled Persons Rights,Disability Rights,Handicapped Persons Rights,Handicapped Rights,,,,,,,,,,,,,,,,,,,,,,,,,,,,,,,,,,,,,,,,,,,,,,,,,,,,,,,,,,,,,,,,,,,,,,,,,,,,,,,,,,,,,,,,,,,,,,,,,,,,,,,,,,,,,,,,,,,,,,,,,,,,,,,,,,,,,,,,,,,,,,,,,,,,,,,,,,,,,,,,,,,,,,,,,,,,,,,,,,,,,,,,,,,,,,,,,,,,,,,,,,,,,,,,,,,,,,,,,,,,,,
R24,Organizations that support the passage and enforcement of laws and other social measures that protect and promote the rights and interests of women.,Womens Rights,Sexual Equality,Womens Economic Empowerment,,,,,,,,,,,,,,,,,,,,,,,,,,,,,,,,,,,,,,,,,,,,,,,,,,,,,,,,,,,,,,,,,,,,,,,,,,,,,,,,,,,,,,,,,,,,,,,,,,,,,,,,,,,,,,,,,,,,,,,,,,,,,,,,,,,,,,,,,,,,,,,,,,,,,,,,,,,,,,,,,,,,,,,,,,,,,,,,,,,,,,,,,,,,,,,,,,,,,,,,,,,,,,,,,,,,,,,,,,,,,,,
R25,Organizations that support the passage and enforcement of laws and other social measures that protect and promote the rights of older adults.,Seniors Rights,Age Discrimination,,,,,,,,,,,,,,,,,,,,,,,,,,,,,,,,,,,,,,,,,,,,,,,,,,,,,,,,,,,,,,,,,,,,,,,,,,,,,,,,,,,,,,,,,,,,,,,,,,,,,,,,,,,,,,,,,,,,,,,,,,,,,,,,,,,,,,,,,,,,,,,,,,,,,,,,,,,,,,,,,,,,,,,,,,,,,,,,,,,,,,,,,,,,,,,,,,,,,,,,,,,,,,,,,,,,,,,,,,,,,,,,
R26,"Organizations that support the passage and enforcement of laws and other social measures that protect and promote the rights and interests of individuals who are gay, lesbian, bisexual, or transgendered.",Lesbian & Gay Rights,Gay Rights,Homosexual Rights,Lesbian Rights,,,,,,,,,,,,,,,,,,,,,,,,,,,,,,,,,,,,,,,,,,,,,,,,,,,,,,,,,,,,,,,,,,,,,,,,,,,,,,,,,,,,,,,,,,,,,,,,,,,,,,,,,,,,,,,,,,,,,,,,,,,,,,,,,,,,,,,,,,,,,,,,,,,,,,,,,,,,,,,,,,,,,,,,,,,,,,,,,,,,,,,,,,,,,,,,,,,,,,,,,,,,,,,,,,,,,,,,,,,,,,
R27,Organizations that support the passage and enforcement of laws and other social measures that protect and promote the rights and interests of patients.,Patients' Rights,,,,,,,,,,,,,,,,,,,,,,,,,,,,,,,,,,,,,,,,,,,,,,,,,,,,,,,,,,,,,,,,,,,,,,,,,,,,,,,,,,,,,,,,,,,,,,,,,,,,,,,,,,,,,,,,,,,,,,,,,,,,,,,,,,,,,,,,,,,,,,,,,,,,,,,,,,,,,,,,,,,,,,,,,,,,,,,,,,,,,,,,,,,,,,,,,,,,,,,,,,,,,,,,,,,,,,,,,,,,,,,,,
R28,Organizations that support the passage and enforcement of laws and other social measures that protect and promote the rights and interests of children and youth.,Children's Rights,CASA,Child Advocacy,Court Appointed Special Advocates,,,,,,,,,,,,,,,,,,,,,,,,,,,,,,,,,,,,,,,,,,,,,,,,,,,,,,,,,,,,,,,,,,,,,,,,,,,,,,,,,,,,,,,,,,,,,,,,,,,,,,,,,,,,,,,,,,,,,,,,,,,,,,,,,,,,,,,,,,,,,,,,,,,,,,,,,,,,,,,,,,,,,,,,,,,,,,,,,,,,,,,,,,,,,,,,,,,,,,,,,,,,,,,,,,,,,,,,,,,,,,
R29,Organizations that support the passage and enforcement of laws and other social measures that protect and promote the rights of groups of workers and employees.,Employee & Workers' Rights,,,,,,,,,,,,,,,,,,,,,,,,,,,,,,,,,,,,,,,,,,,,,,,,,,,,,,,,,,,,,,,,,,,,,,,,,,,,,,,,,,,,,,,,,,,,,,,,,,,,,,,,,,,,,,,,,,,,,,,,,,,,,,,,,,,,,,,,,,,,,,,,,,,,,,,,,,,,,,,,,,,,,,,,,,,,,,,,,,,,,,,,,,,,,,,,,,,,,,,,,,,,,,,,,,,,,,,,,,,,,,,,,
R30,"Organizations that work for increased harmony and understanding among diverse groups in the community and to reduce or eliminate tensions and violence based on age, gender, race, color, sexual preference, creed, national origin, income level or stereotypical identification.",Intergroup & Race Relations,Diversity Training,Intergroup Relations,Multicultural Understanding,Race Relations,,,,,,,,,,,,,,,,,,,,,,,,,,,,,,,,,,,,,,,,,,,,,,,,,,,,,,,,,,,,,,,,,,,,,,,,,,,,,,,,,,,,,,,,,,,,,,,,,,,,,,,,,,,,,,,,,,,,,,,,,,,,,,,,,,,,,,,,,,,,,,,,,,,,,,,,,,,,,,,,,,,,,,,,,,,,,,,,,,,,,,,,,,,,,,,,,,,,,,,,,,,,,,,,,,,,,,,,,,,,,
R40,"Organizations that encourage citizens to participate in the political process, in a nonpartisan manner, by providing opportunities for political involvement, access to public officials, information that is necessary to make informed decisions at the ballot box or assistance in registering to vote.",Voter Education & Registration,Election Regulation,League of Women Voters,Voter Education,Voter Participation,Voter Registration,Voter Turnout,,,,,,,,,,,,,,,,,,,,,,,,,,,,,,,,,,,,,,,,,,,,,,,,,,,,,,,,,,,,,,,,,,,,,,,,,,,,,,,,,,,,,,,,,,,,,,,,,,,,,,,,,,,,,,,,,,,,,,,,,,,,,,,,,,,,,,,,,,,,,,,,,,,,,,,,,,,,,,,,,,,,,,,,,,,,,,,,,,,,,,,,,,,,,,,,,,,,,,,,,,,,,,,,,,,,,,,,,,,
R60,Organizations that protect the rights of people guaranteed by the Constitution and promote the passage of laws or other social measures that extend individual rights or more effectively protect them. Use this code for organizations that advocate for a wide variety of civil liberties or for specific rights that are not specified below.,Civil Liberties,Academic Freedom,Bill of Rights,Civil Liberties,Constitutional Rights,Criminal Rights,Cyber-Liberties,Death Penalty Advocacy,Death Penalty Issues,Due Process,Freedom of Association,Freedom of Information,Freedom of Religion,Gun Control Advocacy,Legal Rights,Library Censorship,Political Rights,Right of Assembly,Right to Bear Arms,Right to Privacy,,,,,,,,,,,,,,,,,,,,,,,,,,,,,,,,,,,,,,,,,,,,,,,,,,,,,,,,,,,,,,,,,,,,,,,,,,,,,,,,,,,,,,,,,,,,,,,,,,,,,,,,,,,,,,,,,,,,,,,,,,,,,,,,,,,,,,,,,,,,,,,,,,,,,,,,,,,,,,,,,,,,,,,,,,,,,,,,,,,,,,,,,,,,,,,,,,,,,,,,,,,,,,
R61,Organizations that support the passage and enforcement of laws and other social measures which preserve a womans right to terminate her pregnancy.,Reproductive Rights,Abortion Rights,Pro-Choice Advocacy,Right to Choose,,,,,,,,,,,,,,,,,,,,,,,,,,,,,,,,,,,,,,,,,,,,,,,,,,,,,,,,,,,,,,,,,,,,,,,,,,,,,,,,,,,,,,,,,,,,,,,,,,,,,,,,,,,,,,,,,,,,,,,,,,,,,,,,,,,,,,,,,,,,,,,,,,,,,,,,,,,,,,,,,,,,,,,,,,,,,,,,,,,,,,,,,,,,,,,,,,,,,,,,,,,,,,,,,,,,,,,,,,,,,,
R62,Organizations that support the passage of legislation which assigns legal rights to the unborn and seeks to criminalize the termination of unwanted pregnancies.,Right to Life,Anti-Abortion,Fetal Rights,Pro-Life Advocacy,,,,,,,,,,,,,,,,,,,,,,,,,,,,,,,,,,,,,,,,,,,,,,,,,,,,,,,,,,,,,,,,,,,,,,,,,,,,,,,,,,,,,,,,,,,,,,,,,,,,,,,,,,,,,,,,,,,,,,,,,,,,,,,,,,,,,,,,,,,,,,,,,,,,,,,,,,,,,,,,,,,,,,,,,,,,,,,,,,,,,,,,,,,,,,,,,,,,,,,,,,,,,,,,,,,,,,,,,,,,,,
R63,Organizations that support the right of the press to freedom of expression without censorship or other restrictions by government and/or which support the right of the media to maintain confidential sources.,"Censorship, Freedom of Speech & Press",Anti-Censorship Advocacy,Censorship,Cyber-Liberties,Freedom of Speech,Free Speech,Freedom of the Press,Library Censorship,,,,,,,,,,,,,,,,,,,,,,,,,,,,,,,,,,,,,,,,,,,,,,,,,,,,,,,,,,,,,,,,,,,,,,,,,,,,,,,,,,,,,,,,,,,,,,,,,,,,,,,,,,,,,,,,,,,,,,,,,,,,,,,,,,,,,,,,,,,,,,,,,,,,,,,,,,,,,,,,,,,,,,,,,,,,,,,,,,,,,,,,,,,,,,,,,,,,,,,,,,,,,,,,,,,,,,,,,,
R65,Organizations that support the passage of legislation and other social measures that protect or extend the rights of individuals to conduct their lives according to the precepts of their faith.,Freedom of Religion Issues,,,,,,,,,,,,,,,,,,,,,,,,,,,,,,,,,,,,,,,,,,,,,,,,,,,,,,,,,,,,,,,,,,,,,,,,,,,,,,,,,,,,,,,,,,,,,,,,,,,,,,,,,,,,,,,,,,,,,,,,,,,,,,,,,,,,,,,,,,,,,,,,,,,,,,,,,,,,,,,,,,,,,,,,,,,,,,,,,,,,,,,,,,,,,,,,,,,,,,,,,,,,,,,,,,,,,,,,,,,,,,,,,
R67,Organizations that support the right of people who may be terminally ill to end their own lives in a planned manner either by active means or by the removal of life-support systems.,Right to Die & Euthanasia,Assisted Suicide,Death with Dignity,Do Not Resuscitate Orders,Doctor Assisted Death,Doctor Assisted Suicide,Euthanasia,Hemlock Society,Living Wills,Mercy Killings,Physician Assisted Death,Physician Assisted Suicide,Rationale Suicide,Right to Die,,,,,,,,,,,,,,,,,,,,,,,,,,,,,,,,,,,,,,,,,,,,,,,,,,,,,,,,,,,,,,,,,,,,,,,,,,,,,,,,,,,,,,,,,,,,,,,,,,,,,,,,,,,,,,,,,,,,,,,,,,,,,,,,,,,,,,,,,,,,,,,,,,,,,,,,,,,,,,,,,,,,,,,,,,,,,,,,,,,,,,,,,,,,,,,,,,,,,,,,,,,,,,,,,,,,
R99,"Use this code for organizations that clearly provide civil rights, social action or advocacy services where the major purpose is unclear enough that a more specific code cannot be accurately assigned.","Civil Rights, Social Action & Advocacy N.E.C.",,,,,,,,,,,,,,,,,,,,,,,,,,,,,,,,,,,,,,,,,,,,,,,,,,,,,,,,,,,,,,,,,,,,,,,,,,,,,,,,,,,,,,,,,,,,,,,,,,,,,,,,,,,,,,,,,,,,,,,,,,,,,,,,,,,,,,,,,,,,,,,,,,,,,,,,,,,,,,,,,,,,,,,,,,,,,,,,,,,,,,,,,,,,,,,,,,,,,,,,,,,,,,,,,,,,,,,,,,,,,,,,,
S,,Community Improvement & Capacity Building,,,,,,,,,,,,,,,,,,,,,,,,,,,,,,,,,,,,,,,,,,,,,,,,,,,,,,,,,,,,,,,,,,,,,,,,,,,,,,,,,,,,,,,,,,,,,,,,,,,,,,,,,,,,,,,,,,,,,,,,,,,,,,,,,,,,,,,,,,,,,,,,,,,,,,,,,,,,,,,,,,,,,,,,,,,,,,,,,,,,,,,,,,,,,,,,,,,,,,,,,,,,,,,,,,,,,,,,,,,,,,,,,
S01,"Organizations whose activities focus on influencing public policy within the Community Improvement, Capacity Building major group area. Includes a variety of activities from public education and influencing public opinion to lobbying national and state legislatures.",Alliances & Advocacy,Lobbying,Public Awareness,,,,,,,,,,,,,,,,,,,,,,,,,,,,,,,,,,,,,,,,,,,,,,,,,,,,,,,,,,,,,,,,,,,,,,,,,,,,,,,,,,,,,,,,,,,,,,,,,,,,,,,,,,,,,,,,,,,,,,,,,,,,,,,,,,,,,,,,,,,,,,,,,,,,,,,,,,,,,,,,,,,,,,,,,,,,,,,,,,,,,,,,,,,,,,,,,,,,,,,,,,,,,,,,,,,,,,,,,,,,,,,
S02,"Consultation, training, and other forms of management assistance services to nonprofit groups within the Community Improvement, Capacity Building major group area.",Management & Technical Assistance,,,,,,,,,,,,,,,,,,,,,,,,,,,,,,,,,,,,,,,,,,,,,,,,,,,,,,,,,,,,,,,,,,,,,,,,,,,,,,,,,,,,,,,,,,,,,,,,,,,,,,,,,,,,,,,,,,,,,,,,,,,,,,,,,,,,,,,,,,,,,,,,,,,,,,,,,,,,,,,,,,,,,,,,,,,,,,,,,,,,,,,,,,,,,,,,,,,,,,,,,,,,,,,,,,,,,,,,,,,,,,,,,
S03,"Learned societies, professional councils, and other organizations that bring together individuals or organizations with a common professional or vocational interest within the Community Improvement, Capacity Building major group area.",Professional Societies & Associations,,,,,,,,,,,,,,,,,,,,,,,,,,,,,,,,,,,,,,,,,,,,,,,,,,,,,,,,,,,,,,,,,,,,,,,,,,,,,,,,,,,,,,,,,,,,,,,,,,,,,,,,,,,,,,,,,,,,,,,,,,,,,,,,,,,,,,,,,,,,,,,,,,,,,,,,,,,,,,,,,,,,,,,,,,,,,,,,,,,,,,,,,,,,,,,,,,,,,,,,,,,,,,,,,,,,,,,,,,,,,,,,,
S05,"Organizations whose primary purpose is to conduct research and/or public policy analysis within the Community Improvement, Capacity Building major group area.",Research Institutes & Public Policy Analysis,Community Health and Welfare Planning,,,,,,,,,,,,,,,,,,,,,,,,,,,,,,,,,,,,,,,,,,,,,,,,,,,,,,,,,,,,,,,,,,,,,,,,,,,,,,,,,,,,,,,,,,,,,,,,,,,,,,,,,,,,,,,,,,,,,,,,,,,,,,,,,,,,,,,,,,,,,,,,,,,,,,,,,,,,,,,,,,,,,,,,,,,,,,,,,,,,,,,,,,,,,,,,,,,,,,,,,,,,,,,,,,,,,,,,,,,,,,,,
S11,Organizations existing as a fund-raising entity for a single institution within the Community Improvement & Capacity Building major group area.,Single Organization Support,,,,,,,,,,,,,,,,,,,,,,,,,,,,,,,,,,,,,,,,,,,,,,,,,,,,,,,,,,,,,,,,,,,,,,,,,,,,,,,,,,,,,,,,,,,,,,,,,,,,,,,,,,,,,,,,,,,,,,,,,,,,,,,,,,,,,,,,,,,,,,,,,,,,,,,,,,,,,,,,,,,,,,,,,,,,,,,,,,,,,,,,,,,,,,,,,,,,,,,,,,,,,,,,,,,,,,,,,,,,,,,,,
S12,"Organizations that raise and distribute funds for multiple organizations within the Community Improvement, Capacity Building major group area.",Fund Raising & Fund Distribution,,,,,,,,,,,,,,,,,,,,,,,,,,,,,,,,,,,,,,,,,,,,,,,,,,,,,,,,,,,,,,,,,,,,,,,,,,,,,,,,,,,,,,,,,,,,,,,,,,,,,,,,,,,,,,,,,,,,,,,,,,,,,,,,,,,,,,,,,,,,,,,,,,,,,,,,,,,,,,,,,,,,,,,,,,,,,,,,,,,,,,,,,,,,,,,,,,,,,,,,,,,,,,,,,,,,,,,,,,,,,,,,,
S19,"Organizations that provide all forms of support except for financial assistance or fund raising for other organizations within the Community Improvement, Capacity Building major group area.",Support N.E.C.,,,,,,,,,,,,,,,,,,,,,,,,,,,,,,,,,,,,,,,,,,,,,,,,,,,,,,,,,,,,,,,,,,,,,,,,,,,,,,,,,,,,,,,,,,,,,,,,,,,,,,,,,,,,,,,,,,,,,,,,,,,,,,,,,,,,,,,,,,,,,,,,,,,,,,,,,,,,,,,,,,,,,,,,,,,,,,,,,,,,,,,,,,,,,,,,,,,,,,,,,,,,,,,,,,,,,,,,,,,,,,,,,
